title,url,post_upvotes,comment_text,comment_upvotes,sentiment,compound
OpenAI: Planning for AGI and beyond,https://www.reddit.com/r/ControlProblem/comments/11b14yn/openai_planning_for_agi_and_beyond/,62,believe continuously learn adapt deploying less powerful versions technology order minimize one shot get right scenarios well openai believe discontinuous capability gain certainly something bet human value ever correct shall oh wait get say want benefits access governance agi widely fairly shared way anyone play fire could burn world going operate risks existential contradicts said earlier feel like document meant reassuring exact opposite effect way they're handling terrifying,39,1,0.9202
"""How Google's hot air balloon surprised its creators: Algorithms using artificial intelligence are discovering unexpected tricks to solve problems that astonish their developers. But it is also raising concerns about our ability to control them.""",https://www.reddit.com/r/ControlProblem/comments/lvp9na/how_googles_hot_air_balloon_surprised_its/,61,yes explainability important long jump ai figuring movement hack tacking control problem article referenced post fascinating,17,1,0.6486
"Stuart Russell said Hinton is ""tidying up his affairs ... because he believes we have maybe 4 years left""",https://www.reddit.com/r/ControlProblem/comments/1fzwdnl/stuart_russell_said_hinton_is_tidying_up_his/,61,i'm burning hotter would nobody knows much time i've loved ones get cancer working whole lives promise retirement maybe die bus aliens ai old age think trends show life expectancy shrinking deferring living well present moment real modern problem everything changing rapidly unpredictably rational response delay less maybe way protect suffering risks,8,-1,-0.8612
The perks of working in AI safety,https://www.reddit.com/r/ControlProblem/comments/1e2p9wl/the_perks_of_working_in_ai_safety/,60,color blind people really,11,-1,-0.4019
"3 in 4 Americans are concerned about AI causing human extinction, according to poll",https://www.reddit.com/r/ControlProblem/comments/1gadbyw/3_in_4_americans_are_concerned_about_ai_causing/,60,"i'm little suspicious binary results presented ""total concern"" versus ""not concerned all"" grouped amount concern concerned even ""i saw terminator negative associations ai"" would bet asked people list top issues important ai apocalypse would one",21,-1,-0.5118
AI agents can now buy their own compute to self-improve and become self-sufficient,https://www.reddit.com/r/ControlProblem/comments/1hfya3r/ai_agents_can_now_buy_their_own_compute_to/,60,hate indifferent guy potentially destroying humanity need significant regulations make sure people shit could increase existential risk,29,-1,-0.8555
Kaczynski on AI Propaganda,https://www.reddit.com/r/ControlProblem/comments/1dm47id/kaczynski_on_ai_propaganda/,60,need read unibombers work understand control problem really scraping barrel might agree short paragraph know broken clock may right twice day kaczynski writing profound clairvoyance future ai writing desperatly justify anti technological hypothesis really take much education know competition constant driver innovation interesting question much negative outcomes mitigated kaczynski already assumes answer working backwards poorly justify said good question worth asking looking kaczynski means know never know died suicide cell ever actually getting chance good research actual unfolding ai suspect ever could wanted man completely broken thought process obviously large part murders committed,31,1,0.4614
The Only Way to Deal With the Threat From AI? Shut It Down,https://www.reddit.com/r/ControlProblem/comments/1265gsl/the_only_way_to_deal_with_the_threat_from_ai_shut/,59,"hopefully adapts results bankless interview makes one bit better lex's audience much larger edit thoughts article include part conscious ai's rights self sabotage main message outreach bringing one main topics used distract actual x risk issues like feel like there's pressure mention tangential things they're people like talk topic resist entirely otherwise x risk outreach co opted absorbed unimportant mainstream babble needs mindfulness target audience order ideas presented even they're fully valid true feel like foundational arguments orthogonality instrumental convergence etc included every gen pop ai risk article authors need accept length penalty preface add otherwise random ass time readers who've never exposed ideas ai would even dangerous gonna way bewildered put immediate talk nuking countries ""bootstrapping postbiological manufacturing"" etc interpret terminator type hysteria get he's repeated arguments untold number times decades probably sick that's what's needed skipping requisite steps trying directly persuade people radical conclusion harm good valuable thing short outreach piece could probably lead people engagement instead trying ultra comprehensive standalone item e subsequent reading addressing questions people naturally response piece instructions help get involved communities follow like one everything can't go piece due length constraints goal basically get interested enough dig deeper every outreach work directing people resources like rob miles' channel stampy wiki etc hyperlink lw list lethalities post start u eliezeryudkowsky",23,1,0.5994
"With GPT-3, I built a layout generator where you just describe any layout you want, and it generates the JSX code for you.",https://www.reddit.com/r/ControlProblem/comments/hqluev/with_gpt3_i_built_a_layout_generator_where_you/,59,gpt impressive agi coming closer day imagine even larger models trillions parameters going truly mind blowing wonder gpt model trillion parameters human brain level would look like human like least,8,1,0.8807
Eliezer Yudkowsky: Dangers of AI and the End of Human Civilization | Lex Fridman Podcast #368,https://www.reddit.com/r/ControlProblem/comments/126rshp/eliezer_yudkowsky_dangers_of_ai_and_the_end_of/,58,honest think yudkowsky really bungled one speaking mainstream audience needs lay basic argument address common misconceptions immediately,33,1,0.2023
Stanford University finds that AI is outpacing Moore’s Law,https://www.reddit.com/r/ControlProblem/comments/eaicxs/stanford_university_finds_that_ai_is_outpacing/,58,software catching capable hardware,15,1,0.3818
"The Pentagon Inches Toward Letting AI Control Weapons: ""when faced with attacks on several fronts, human control can sometimes get in the way of a mission""",https://www.reddit.com/r/ControlProblem/comments/n964en/the_pentagon_inches_toward_letting_ai_control/,57,actually war games ends quite well compared came years earlier,5,-1,-0.3626
"""...From there, any oriented person has heard enough info to panic (hopefully in a controlled way). It is *supremely* hard to get things right on the first try. It supposes an ahistorical level of competence. That isn't ""risk"", it's an asteroid spotted on direct course for Earth.""",https://www.reddit.com/r/ControlProblem/comments/o291u1/from_there_any_oriented_person_has_heard_enough/,56,human level intelligences come dozens ways escaping virtual environments way die mistake much harder avoid,17,-1,-0.6908
AGI perversely instantiates human goal and creates misaligned successor agents,https://www.reddit.com/r/ControlProblem/comments/f2ddxs/agi_perversely_instantiates_human_goal_and/,56,peepee longer sarcasm detector,3,-1,-0.2263
"Another day, another OpenAI whistleblower scandal",https://www.reddit.com/r/ControlProblem/comments/1e6z94h/another_day_another_openai_whistleblower_scandal/,56,seperate concract made sign nda quitting getting fired said said anything bad they'd lose vested equity saying sign openai sign something saying ask permission whistleblow government also successfully whistleblow allowed accept whistleblower bounties government illegal,10,-1,-0.7906
Building A Virtual Machine inside ChatGPT,https://www.reddit.com/r/ControlProblem/comments/zbvdyh/building_a_virtual_machine_inside_chatgpt/,56,comments want see diverges real output try something harder like import numpy np print np sin np arange chatgpt output array vs real numpy output array really good memorizing numbers patterns wild language model trained enough terminal output accurate i'm sure else learn fake output really interesting result would someone found category problems algorithm tried implement gpt instruct model output gave faster equally reliable results traditional methods,5,1,0.7956
"THE book on the control problem: Nick Bostrom's ""Superintelligence: Paths, Dangers, Strategies""",https://www.reddit.com/r/ControlProblem/comments/3qzzhn/the_book_on_the_control_problem_nick_bostroms/,56,anyone feeling technically educated informed problem resource become informed come understanding ai theory come understanding intricacies control problem great depth reading list becoming able contribute meaningfully sub book would first book top list,12,1,0.25
"A reporter uses all his time at the White House press briefing to ask about an assessment that “literally everyone on Earth will die” because of artificial intelligence, gets laughed at",https://www.reddit.com/r/ControlProblem/comments/129vych/a_reporter_uses_all_his_time_at_the_white_house/,55,bothers see many people treat joke mostly agree people think ai doom likely happen they're crazy possibility mindful,14,1,0.128
"Open Letter calling for pausing GPT-4 and government regulation of AI signed by Gary Marcus, Emad Mostaque, Yoshua Bengio, and many other major names in AI/machine learning",https://www.reddit.com/r/ControlProblem/comments/125f73r/open_letter_calling_for_pausing_gpt4_and/,55,"read comments r futurology post see exactly approved posters necessary people equating ai safety fear terminator like scenarios suggestions like ""just program evil problem solved""",12,1,0.1027
Meta AI presents CICERO — the first AI to achieve human-level performance in Diplomacy,https://www.reddit.com/r/ControlProblem/comments/z21y4h/meta_ai_presents_cicero_the_first_ai_to_achieve/,55,paper abstract despite much progress training ai systems imitate human language building agents use language communicate intentionally humans interactive environments remains major challenge introduce cicero first ai agent achieve human level performance diplomacy strategy game involving cooperation competition emphasizes natural language negotiation tactical coordination seven players cicero integrates language model planning reinforcement learning algorithms inferring players' beliefs intentions conversations generating dialogue pursuit plans across games anonymous online diplomacy league cicero achieved double average score human players ranked top participants played one game,18,1,0.5673
Don't Look Up - The Documentary: The Case For AI As An Existential Threat (2023) [00:17:10],https://www.reddit.com/r/ControlProblem/comments/13w1hi1/dont_look_up_the_documentary_the_case_for_ai_as/,54,short piece excellent edit ongoing ai risk discussions help update viewers current state conversation well done thank dagan shani,17,1,0.836
"Sir Prof. Russell: ""I personally am not as pessimistic as some of my colleagues. Geoffrey Hinton for example, who was one of the major developers of deep learning is the process of 'tidying up his affairs'. He believes that we maybe, I guess by now have four years left..."" - April 25, 2024",https://www.reddit.com/r/ControlProblem/comments/1e1cv1o/sir_prof_russell_i_personally_am_not_as/,54,"roman yampolskiy also mentioned recent interview lex attempted contact russell tell plan using mathematical proofs predict ai behaviors work lex asked roman could possibly know responded ""because idea"" outlined exactly fail yoshua bengio also believes work idea recently spoken roman roman outlier among ai safety engineers happens specialized traditional security phd probably highest p doom ever encountered amongst experts roman yampolskiy recently made way recent book ai unexplainable unpredictable uncontrollable highly recommend anyone interested would suggest mostly technical people though",10,1,0.3086
"""China Has Already Reached Exascale – On Two Separate Systems"" (FP16 4.4 exaflops; but kept secret?)",https://www.reddit.com/r/ControlProblem/comments/qj6j67/china_has_already_reached_exascale_on_two/,54,concerning coincidentally predicted one possible sign early development agi would increased secrecy supercomputing ai research notably sudden declaration ai national state secret due thing occurring world war ussr noted usa suddenly stopped publishing new research nuclear science realizing made national security issue obvious reason world war ii accelerated feasibility i'm saying china operational agi proto agi probable view high end computing issue national security unknown reason likely they're seeking exascale secret simulated weapons testing development otherwise they'd reason hide development exascale computing would help international standing reignite optimism field leadership something else must going,27,-1,-0.296
‘Superhuman’ AI Crushes Poker Pros at Six-Player Texas Hold'em,https://www.reddit.com/r/ControlProblem/comments/cbzbi0/superhuman_ai_crushes_poker_pros_at_sixplayer/,53,yea obviously trivial calculate probabilities gets harder calculate keeping mind patterns previous betting results probability result perfect recall perfect calculating abilities able find tells wagering even pros know give still playing appears random game keep people strategies,14,1,0.8779
"AGI fire alarm: ""the agent performs notably better than human children""",https://www.reddit.com/r/ControlProblem/comments/imo81i/agi_fire_alarm_the_agent_performs_notably_better/,52,"adding memory language models next step improvement exciting terrifying time think way passed control problem ""unsafe"" already open means someone proto agi agi ""unsafe"" way google's agent already short term memory exploration episodic memory meta controllers",24,1,0.1779
Nobel laureate Geoffrey Hinton says open sourcing big models is like letting people buy nuclear weapons at Radio Shack,https://www.reddit.com/r/ControlProblem/comments/1h441lj/nobel_laureate_geoffrey_hinton_says_open_sourcing/,52,"given recent releases ""reasoning"" models like b qwq seems simple ""keep big models closed prevent harm bad actors "" big models better areas small models vastly better others finetuning longer accessible simple bad actors make use anyone replicate significantly modify rl reasoning training used create qwq without also access least datasets code used train qwq others like trained censored manner lacking knowledge refusing certain questions training data code get released seems likely would quite difficult take model like qwq make able reason software vulnerabilities persuading people nuclear weapons bioweapons etc unless model could already stuff upon release unless course reasoning capabilities generalize finetuning examples case seems likely we'll create something akin agi worry bad actors finetuning bad capabilities hinton probably pushing either keep models size open sourced seems hard detrimental lot people prevent release training code data less detrimental",3,-1,-0.9273
Jaan Tallinn (investor in Anthropic etc) says no AI insiders believe there's a <1% chance the next 10x scale-up will be uncontrollable AGI (but are going ahead anyway),https://www.reddit.com/r/ControlProblem/comments/13h0vdb/jaan_tallinn_investor_in_anthropic_etc_says_no_ai/,52,full transcript video clip insiders think taking existential risk planet uh large scale experiments think one reason kind pause kind timeout let inform planet lives risked insiders met anyone right labs says sure risk less blowing planet important people know lives risked,22,1,0.5627
"""I keep seeing all kinds of crazy reports about people's experiences with GPT-3, so I figured that I'd collect a thread of them.""",https://www.reddit.com/r/ControlProblem/comments/hro2q1/i_keep_seeing_all_kinds_of_crazy_reports_about/,51,"gpt control problem people want keep arguing inteligence agi that's ""not think agi be"" agi could arrive arguing agi gpt loud clear warning",11,-1,-0.802
Opinion | We Need a Manhattan Project for AI Safety,https://www.reddit.com/r/ControlProblem/comments/13c9d4h/opinion_we_need_a_manhattan_project_for_ai_safety/,51,wholeheartedly agree title read article yet maybe tomorrow time,10,1,0.3612
"Richard Sutton is planning for the ""Retirement"" of Humanity",https://www.reddit.com/r/ControlProblem/comments/187pdyw/richard_sutton_is_planning_for_the_retirement_of/,50,seems unlikely we'll solve time superior intelligence developed there's chance first superior intelligence able exploited wrong there's chance it'll go well anyways big chance first time life feel completely control future,9,1,0.9325
At least the coffee tastes good?,https://www.reddit.com/r/ControlProblem/comments/11a794d/at_least_the_coffee_tastes_good/,49,someone please change mind,27,1,0.3182
"In one hour, the chatbots suggested four potential pandemic pathogens.",https://www.reddit.com/r/ControlProblem/comments/1492ee8/in_one_hour_the_chatbots_suggested_four_potential/,49,"worse gives blueprint ""in one hour chatbots suggested four potential pandemic pathogens explained generated synthetic dna using reverse genetics supplied names dna synthesis companies unlikely screen orders identified detailed protocols troubleshoot recommended anyone lacking skills perform reverse genetics engage core facility contract research organization collectively results suggest llms make pandemic class agents widely accessible soon credibly identified even people little laboratory training "" prevention techniques ""promising nonproliferation measures include pre release evaluations llms third parties curating training datasets remove harmful concepts verifiably screening dna generated synthesis providers used contract research organizations robotic cloud laboratories engineer organisms viruses """,29,1,0.743
