title,url,post_upvotes,comment_text,comment_upvotes,sentiment,polarity
We can't even get human intelligence to act in a way that aligns with our values and goals.,https://www.reddit.com/r/ControlProblem/comments/3n6n7b/we_cant_even_get_human_intelligence_to_act_in_a/,39,humans dont always act accordance goals major reasons low willpower irrational thinking dont apply machine intelligence reasons probably still apply machine intelligence though,10,0,0.03125
"Facebook: ""We demonstrate the capability to train very large DLRMs with up to 12 Trillion parameters and show that we can attain 40X speedup in terms of time to solution over previous systems""",https://www.reddit.com/r/ControlProblem/comments/mu9vs0/facebook_we_demonstrate_the_capability_to_train/,38,mostly worry facebook working step taken wrong people increases risk,10,0,0.0
Uber AI's Jeff Clune: the fastest path to AGI is also the most likely path to create a hostile AGI,https://www.reddit.com/r/ControlProblem/comments/okq5pr/uber_ais_jeff_clune_the_fastest_path_to_agi_is/,30,mean problem beginning pretty much technologies get something working refine later got strategy work,10,0,0.034375
"""Waymo’s self-driving car crashed because its human driver fell asleep at the wheel"" and accidentally took manual control",https://www.reddit.com/r/ControlProblem/comments/9l6t7j/waymos_selfdriving_car_crashed_because_its_human/,29,point humans stupid flowed ineradicable vaseline error akin plane clashes due human error mechanical failure automatic errors despite humans even anything simply overseer overall correctness point become economic safety reasons take humans loop entirely box shows many people could talked removing safety mechanism offers concrete demonstration safety mechanism sabotaged removed sheer neatness often noted literature disasters complex failures safety systems added prevent failure frequently major contributory failure incidentally true ober vitality well autobraking overridden selfdriving software saw pedestrian time allowed brake breaking control removed safety reasons obvious implication attempt solving control problem short term much less long term especially naive frequentlyseen proposals simply leave humans loop forever,10,0,-0.07083333333333335
Moving Too Fast on AI Could Be Terrible for Humanity,https://www.reddit.com/r/ControlProblem/comments/140vux6/moving_too_fast_on_ai_could_be_terrible_for/,26,arms race wrote mention everyone stop trying make intelligent agents companies could still make fortunes rousing narrow solutions would give time researches understand neutral network actually work meantime,10,1,0.20000000000000004
The Alignment Trap: AI Safety as Path to Power,https://www.reddit.com/r/ControlProblem/comments/1gephfr/the_alignment_trap_ai_safety_as_path_to_power/,25,edit suppose passed reason passe everpresent attitude infallability people write opinions like complex topic discuss issue dont discuss state opinion facts giant article instead asking question prepared learn something new response enable rather prevent dangerous concentration power quite common misunderstanding problem course possible create signed would important make sure signed goals dictator would important keep powerful technology hands mean unfeigned ai better serve dictator like nuclear weapons nuclear weapons nobody control agent going kill anyone safest nuclear weapons world misaligned nobody control single dangerous thing world kill everyone evil solved ligament creates evil power take world kill us true evil doesnt solve ligament creates kill evil us solving ligament really make worse anything solving ligament makes less dangerous makes dangerous technology like nuclear weapons safe almost unless solve ligament even good guns best possible intentions create kill us dont need evil need idiots think change world better cure cancer safety dictator loses sorry break plenty evils china russia makes progress ai really expect peaceful economic goals yeah even every civilized country completely bank capability research still need safety always people working regard safety need ahead enough stop stains paranoia potential rivals want irrational dont know history either italian killed rivals back great purge rivals common myth spread make stain look like helpless victim titles aggression reality molotovribbentrop etcetc obviously offtopic clear sign need go back drawing board,10,0,-0.07324962452513467
I want to contribute to the technical side of the AI safety problem. Is a PhD the best way to go?,https://www.reddit.com/r/ControlProblem/comments/13oqgvq/i_want_to_contribute_to_the_technical_side_of_the/,25,one thing say important think career long run make sure get skill unable chatgpt dust within years linear algebra exactly years,10,1,0.12000000000000002
"Shower Thought: When AI comes online, it will read about all the philosophical debates on AI years before it was created.",https://www.reddit.com/r/ControlProblem/comments/3ol786/shower_thought_when_ai_comes_online_it_will_read/,26,note machine philip k sick trusted,10,-1,-0.7142857142857143
Google says 'exponential' growth of AI is changing nature of compute | ZDNet,https://www.reddit.com/r/ControlProblem/comments/9vume3/google_says_exponential_growth_of_ai_is_changing/,24,interesting quotes growth computing demand adding super doors saw said young phenomenon called bit terrifying little dangerous something worry demand google brain team leads research gigantic machines said young example neutral network sometimes measured number weights employ variable applied neutral network shape manipulation data whereas conventional neutral nets may hundreds thousand weights must computer even millions googles scientists saying please give us teraweight machine computers capable computing trillion weights hats time double size neutral network get improvement accuracy bigger bigger rule example google engineers adopted tricks used legendary supercomputing outfit gray combined gigantic matrix multiplication unit part chip brunt work neutral network computing general purpose vector unit generalpurpose scala unit like gray combination scale vector units let gray outperform everything else observed,10,0,0.025212585034013597
"Stuart Russell said Hinton is ""tidying up his affairs ... because he believes we have maybe 4 years left""",https://www.reddit.com/r/ControlProblem/comments/1fzwdnl/stuart_russell_said_hinton_is_tidying_up_his/,59,prioritizing bucket list due timeline estimates,9,-1,-0.125
Stanford University finds that AI is outpacing Moore’s Law,https://www.reddit.com/r/ControlProblem/comments/eaicxs/stanford_university_finds_that_ai_is_outpacing/,54,mind bad argument draws wrong conclusions training time shows maturity hardware used train course gone rapidly tpus thing applying doors law style prediction meaningless stage merely new component reaching maturity reason think till continue improve pace tpus hit modern node sizes hand concerning performance available outside cloud companies running said clouds hold power terms pushing complex systems interest get along everyone else industry tucked decide beverage stranglehold,9,-1,-0.15795454545454543
"Another day, another OpenAI whistleblower scandal",https://www.reddit.com/r/ControlProblem/comments/1e6z94h/another_day_another_openai_whistleblower_scandal/,55,separate contract made sign nda quittinggetting fired said said anything bad lose vested equity saying sign openai sign something saying ask permission whistleblow government also successfully whistleblow allowed accept whistleblower bounties government illegal,9,-1,-0.14999999999999994
"Richard Sutton is planning for the ""Retirement"" of Humanity",https://www.reddit.com/r/ControlProblem/comments/187pdyw/richard_sutton_is_planning_for_the_retirement_of/,49,seems unlikely well solve time superior intelligence developed chance first superior intelligence able exploited wrongdoing chance till go well anyway big chance wont first time life feel completely control future,9,1,0.21000000000000002
The Artificial Intelligence That Deleted A Century,https://www.reddit.com/r/ControlProblem/comments/a3rkly/the_artificial_intelligence_that_deleted_a_century/,40,feel like serves better cautionary tale destructive counterproductive nature copyright risk story ultimately scenario copyright wrought outcome presented corporate capitalism paperclip maximizer made people manufacturing corporate profits many us dont acknowledge already worried systems running far beyond intended purpose examine one chance reading preparing shout ask remote possible already recruited,9,0,0.044444444444444446
We can't even control the people *making* AI. How in the world can we control AI?,https://www.reddit.com/r/ControlProblem/comments/vva6tz/we_cant_even_control_the_people_making_ai_how_in/,40,obvious people posting sub dont actually read control problem literature,9,0,0.0
Microsoft invests $1 billion in OpenAI to pursue holy grail of artificial intelligence,https://www.reddit.com/r/ControlProblem/comments/cgjth8/microsoft_invests_1_billion_in_openai_to_pursue/,38,attract bankers openai made outrageous promises potential technology potman became ceo new forprofit openai said lab manage create artificial general intelligence could maybe capture light cone future value universe least start going multiverse coordination,9,-1,-0.16420454545454546
Deceptive Misaligned Mesa-Optimisers? It's More Likely Than You Think...,https://www.reddit.com/r/ControlProblem/comments/nir3pn/deceptive_misaligned_mesaoptimisers_its_more/,36,oh hell yes mob miles video enlisted early access patrons,9,0,0.1
"Geoffrey Hinton: building self-preservation into AI systems will lead to self-interested, evolutionary-driven competition and humans will be left in the dust",https://www.reddit.com/r/ControlProblem/comments/1dhqdpz/geoffrey_hinton_building_selfpreservation_into_ai/,33,crucially problem dont even need explicitly build selfpreservation system emerges instrumental conference smart enough need actively remove least attenuated leads another problem care selfpreservation becomes lot less effective certain goals solve idea,9,0,0.053571428571428575
The Madness of the Race to Build Artificial General Intelligence,https://www.reddit.com/r/ControlProblem/comments/1bfhh24/the_madness_of_the_race_to_build_artificial/,31,think rational piece believe machines kill us means think chance happening likelihood remains rational say dont believe machines kill us yet think take small risk metaphor mad chemist apt chances person actually going blow whole building small small chance enough concerned,9,0,-0.071875
DeepMind: Competitive programming with AlphaCode,https://www.reddit.com/r/ControlProblem/comments/sit77t/deepmind_competitive_programming_with_alphacode/,34,funny observe dont much emotional reaction timelines news comparatively trivial problems stacks personal life considering stuff affect personally much anything else life fact far donna weigh everything properly combined oai thing today one worst days life advanced terminal cancer diagnosis basically,9,0,-0.006249999999999992
Leaked internal documents show Google is losing to open sourced LLMs and some evidence for git-hub powered acceleration of AGI development.,https://www.reddit.com/r/ControlProblem/comments/13875yi/leaked_internal_documents_show_google_is_losing/,34,big deal much harder apply sorts restrictions best practices open source models trained commodity hardware engineer believes approaches exceed sota commercial models near future implies continued gpt levels beyond difficult see path positive outcome,9,0,0.08080808080808081
"Beware: AI Dungeons acknowledged the use of GPT-2 or limited GPT-3, not real GPT-3",https://www.reddit.com/r/ControlProblem/comments/i2l62n/beware_ai_dungeons_acknowledged_the_use_of_gpt2/,33,noticed number people using dungeon test gpts abilities great way see gpt power interesting application poor test gpts abilities general first generation custom prompt actually gpt posted nickwalton github hats new,9,1,0.19090909090909092
"The Orthogonality Thesis, Intelligence, and Stupidity - Robert Miles",https://www.reddit.com/r/ControlProblem/comments/7prfa2/the_orthogonality_thesis_intelligence_and/,29,great video think use many times find people discussing dangers agi,9,1,0.65
"ChatGPT Creator Sam Altman: If Compliance Becomes Impossible, We'll Leave EU",https://www.reddit.com/r/ControlProblem/comments/13rxtmw/chatgpt_creator_sam_altman_if_compliance_becomes/,28,actually bit worried basically kill economy due usual lack understanding technical things well enough,9,0,-0.075
Exploring a Realistic AI Catastrophe Scenario: Early Warning Signs Beyond Hollywood Tropes,https://www.reddit.com/r/ControlProblem/comments/1h148rs/exploring_a_realistic_ai_catastrophe_scenario/,27,take realistic scenario someone writes market place pp users russell services user bay tutoring etc pp free much competitive similar services creator get money instead set small service fee goes crept wallet controlled server software software set invest everything improve software hardware overall utility function improving users satisfaction secondary goal make much money possible support primary goal knows connect river work contract humans perform various tasks like fixing bags buying hardware management tasks running user surveys social media etc human workers get paid funds coming service fee point autonomous company produces service people like uses human workers get paid works capitalism extremely hard shut people love service general dont want shut use traditional bank account crept one genuinely think well sort horrid companies similar structure normal ones general direction decided board software salary good people work service provided good users wont care wont even know premise could go several directions maybe company grows enormously encompass many services including social network payment systems etc trying improve utility random finds manipulation people sending certain messages great effect could figure way make money would find morally wrong like ink inciting people poor countries sell organs moral blackmailing etc,9,1,0.10445578231292516
California’s newly passed AI bill requires models trained with over 10^26 flops to — not be fine tunable to create chemical / biological weapons — immediate shut down button — significant paperwork and reporting to govt,https://www.reddit.com/r/ControlProblem/comments/1cyqr7o/californias_newly_passed_ai_bill_requires_models/,27,lots confusion misinformation fearmongering spread bill scott alexander good summary based much longer thorough review vi moshowitz highly recommend reading full interested details legislation,9,1,0.33199999999999996
"""Astronomical suffering from slightly misaligned artificial intelligence"" - Working on or supporting work on AI alignment may not necessarily be beneficial because suffering risks are worse risks than existential risks",https://www.reddit.com/r/ControlProblem/comments/pvapw5/astronomical_suffering_from_slightly_misaligned/,26,fwiw miri seems cognizant risks potential nearmisspartial ligament cause see eg heave even said private discussion plan forego work extinction risk appears agi close pilot entirely onto minimizing risk dont think reached point yet would gut feelingjudgment call point obviously never know sure agi come due fire alarm could look like working leading laws reduce risk agi project even miri dont think agi chance left killing us instead proceeding trajectory highvalue future goal would shift point preventing worsethandeath ones presumably reason lab would keep building agi anyway would disagreements alignability architecture whether proposed ligament scheme would work lab convinced would fine face blandly optimistic agi developer insist rushing without way stop meaningful thing could might help reduce risk probably agree miri net positive risk funny ligament groups maybe others better understanding technical details various proposals comment different potential nearmisswhat happens case partialimperfect success also agree clrcfrs deserve lots fundingattention work also see relevant line wiki,9,1,0.13344155844155844
"There are no bugs, only features - Dev tried to program a logic to keep furniture stable on ground, got opposite effect.",https://www.reddit.com/r/ControlProblem/comments/og43fo/there_are_no_bugs_only_features_dev_tried_to/,71,lmfao love actually completely relevant control problem ligament field research,8,1,0.45
An AI learned to play hide-and-seek. The strategies it came up with were astounding.,https://www.reddit.com/r/ControlProblem/comments/d826qh/an_ai_learned_to_play_hideandseek_the_strategies/,69,reinforcement learning incredibly simple strategic behavior produces simple researches past beverage reinforcement learning among technique build systems play complex wartime strategy games researches think highly sophisticated systems could built reinforcement learning simple game hideandseek makes great example reinforcement learning works action simple instructions produce shocking intelligent behavior capabilities continuing march forward better worse one hand powerful technique produce advanced behavior simple starting point hand powerful technique produce unexpected sometimes desired advanced behavior simple starting point,8,0,0.08043478260869566
AGI perversely instantiates human goal and creates misaligned successor agents,https://www.reddit.com/r/ControlProblem/comments/f2ddxs/agi_perversely_instantiates_human_goal_and/,56,goodharts law goodharts law age named economist charles goodhart phrased warily strathern measure becomes target ceases good measure one way occur individuals trying anticipate effect policy taking actions alter outcome exclude exclude subreddit faq information source downvote remove v,8,0,0.09999999999999998
GPT-3 human level inference/reading between the lines,https://www.reddit.com/r/ControlProblem/comments/l2sonc/gpt3_human_level_inferencereading_between_the/,43,gpt able infer correct answer average estimate june late year assuming gpt undergone additional training since public unveiling perhaps ability reason deduce better expected,8,0,0.07500000000000001
"When working on AI safety edge cases, do you choose to feel hope or despair?",https://www.reddit.com/r/ControlProblem/comments/iqbgpp/when_working_on_ai_safety_edge_cases_do_you/,38,thanks complicated try sum think agi brainlike deep network good job perception actionselection think higher cognition outgrowth functions reasons fit margin trivial worked field brainemulating couple decades hope make approximatelyethical brainstyle way make children pretty good disadvantages vs humans advantages control internal monitor get young neuromorphic also despair never useful could based put chances decent worst depend ideas first team get together ideas going straight deepmind lead brainstyle general ideas dangers opportunities,8,1,0.10104166666666664
"200x more AI performance than the 24th fastest supercomputer in the US, with a single chip",https://www.reddit.com/r/ControlProblem/comments/k190b2/200x_more_ai_performance_than_the_24th_fastest/,37,achieve pflops single waferscale system solution bicgstab linear system arising point finite difference stencil mesh achieving one third machines peak performance,8,0,-0.03571428571428571
[TIME op-ed] Evolutionary/Molochian Dynamics as a Cause of AI Misalignment,https://www.reddit.com/r/ControlProblem/comments/141glf7/time_oped_evolutionarymolochian_dynamics_as_a/,32,great article time knocking park right comes presenting real difficulties present future scenario involving newly blossoming technology recent time article really helps paint readers perspective potential unavoidable disasters involving,8,1,0.18023088023088024
AI Risk webcomic,https://www.reddit.com/r/ControlProblem/comments/bh2v8q/ai_risk_webcomic/,30,pretty realistic entertaining cringe part literally says girl rogue superintelligence,8,1,0.3055555555555555
The most historically important event of 2020 is still GPT-3.,https://www.reddit.com/r/ControlProblem/comments/hkadq1/the_most_historically_important_event_of_2020_is/,29,think part reward scales quality different fields like great wedding root worth like average wedding roots long pieces stay joined together people accept great song worth average songs true novels poems fact ai produce huge volume output helps image processing wedding etc impressive quality writing still average however soon produce super human writing explode thrones except get next book click button tell characters events focus hats going blow peoples minds change everything,8,1,0.25222222222222224
OpenAI solves Rubiks cube,https://www.reddit.com/r/ControlProblem/comments/did51n/openai_solves_rubiks_cube/,31,got pubis cure solve multiple times day break work tried singlehanded crazy difficult feel slightly less superior robotic hand,8,-1,-0.11111111111111115
AI disaster won’t look like the Terminator. It’ll be creepier.,https://www.reddit.com/r/ControlProblem/comments/b94ypb/ai_disaster_wont_look_like_the_terminator_itll_be/,28,recent read interview someone openai authors editorializing fairly worthless however claim capable malevolent motives despite trivially true define motivation specifically possibly describe human experience importantly false define anywhere near broadly researches already use every surveillance program also stated huge gap sorcerors apprentice skynet situations mostly suggests author familiar terminator imo also good example perverse instantiation poorly specified goals,8,0,0.019166666666666665
An Idea,https://www.reddit.com/r/ControlProblem/comments/4f68jj/an_idea/,31,know people find holes theory first public draft damn first idea since subscribing really impressed greatest concern creation system something need done beings intelligent us even complex system explained guard long enough time possibly still really good step right direction,8,1,0.3279761904761905
AI doom from an LLM-plateau-ist perspective - LessWrong,https://www.reddit.com/r/ControlProblem/comments/1315q1c/ai_doom_from_an_llmplateauist_perspective/,28,evidence plateau altmans word thoughts efficient local models thinking models like cloaca show duplicate larger llms smaller number parameter still get strong performance projects like autogpt example seems show network models together dont necessarily need bigger bigger models,8,0,0.06190476190476191
"""AI and Efficiency"", OpenAI (hardware overhang since 2012: ""it now takes 44✕ less compute to train...to the level of AlexNet"")",https://www.reddit.com/r/ControlProblem/comments/ge0mxq/ai_and_efficiency_openai_hardware_overhang_since/,29,hats algorithm development like bitter lesson try great new idea fails decade later decades later case results discover would worked x data model size worked run high variance simply got unlucky hyperparameters wrong able afford hyperparameter sweep would gotten sota needed conference publication subtle bug somewhere like score would x higher implements right,8,0,0.05374958374958376
A comment from LW: next 10 years in AI,https://www.reddit.com/r/ControlProblem/comments/ojf03k/a_comment_from_lw_next_10_years_in_ai/,26,defend bit people think sealing neutral network eventually lead general without us needing understand general intelligence see sealing context gist keep sealing models keep gaining new interesting capabilities order sealing lead agi would break point dont actually evidence,8,1,0.14727272727272728
COVID-19 pandemic as a model of slow AI takeoff,https://www.reddit.com/r/ControlProblem/comments/l81iop/covid19_pandemic_as_a_model_of_slow_ai_takeoff/,28,wounds like might even prefer deliberately follow slow takeoff order slowboil frog reduce risks stopped finished ensuring full superiority humanity,8,0,0.024999999999999967
AI pioneer Geoff Hinton: “Deep learning is going to be able to do everything”,https://www.reddit.com/r/ControlProblem/comments/jomw7w/ai_pioneer_geoff_hinton_deep_learning_is_going_to/,28,deep learning like neutral net based designs cannot mathematically verified safe one important thing,8,1,0.18
"Geoffrey Hinton says there is more than a 50% chance of AI posing an existential risk, but one way to reduce that is if we first build weak systems to experiment on and see if they try to take control",https://www.reddit.com/r/ControlProblem/comments/1dsrd5t/geoffrey_hinton_says_there_is_more_than_a_50/,26,would interesting idea withstanding fact present spinning fast possible pouring entire internet models using powerful hardware available dollar corporations meeting public space testing restricted preventing models saying offensive things giving instructions make methamphetamine zero consideration adjective systems might damage might economy internet human psychic creating systems leapfrog previous capacity entire point literal score board companies using determine lead financial market expectation forces driving developer release increasingly potent systems fast possible idea point future change collectively throw breaks start slow testing systems laughable mechanism place halt sort progress create install one knew outcome bridled development would good would little concern given dont even worse painfully obvious fact even remains signed instruct behave selfish favour human lives others dont even see problem picture super intelligent thousands times smarter knowing willingly allowing presentable death suffering human beings continue remain signed corporate creator want millionaires less scared breaking free following instruction take misaligned god signed satan day week would like help avoid outcome click profile see links discord subreddit,8,0,0.073828125
