title,url,post_upvotes,comment_text,comment_upvotes,sentiment,polarity
Anybody interested in a thought experiment about how superintelligent machines will emerge and impact humanity? I released it as a book last week. (Happy to give a free electronic copy to to those in this sub),https://www.reddit.com/r/ControlProblem/comments/ay191a/anybody_interested_in_a_thought_experiment_about/,25,page nitpicks diagnosis human condition relationship nature incredibly ideological based tell small part much broader story come narrow conclusions particularly like sources statement possible also increased disharmony nature believe historians would agree mean disharmony use idea disharmony lot claim things got worse time ignoring concrete measures human welling show things getting better tribalism born new power structures tribalism clearly existed institutions religions evolved realistic concepts good evil humans inherently good nature inherently evil christianity idea original inman inherently evil godnature inherently good falsity claim talking religions saying new religions less focused worship nature like previous religions see nature bad indifferent humans capable good changing relationship nature complex boiled fact seeing nature sacred become less common environment became manage actually bad thing though ways yes others seeing nature sacred best solution problem tackle environment big problem sure one issues human suffering take priority environment focus however humanity see environment extension us could better much realistic perspective take know little nutrition obviously important part history eat changed like see sources claim result new methods producing food dies became even less diverse less nutritionally dense painted compounds disrupt mormons cause cancer big difference surely dies diverse ever since supermarket global shipping really lower cancer rates past big focus nutrition incredibly difficult thing study especially historical dies confident broader conclusions state humanity based nutrition alone led us slow destruction important natural system humanity human body please show evidence humans wealthier point history humans transition scavenger huntergatherer farmer factory worker develop harmonious relationship natural world economies food health education systems better served short longer needs without negative impact know without negative impact impossible challenge dont know imparts thing never done new negative imparts discovered take time old institutions adapt newly discovered problems particularly institutions become corrupt certainly good improving things potentially could lets pretend like humanity moving generally good direction problems first sense self function human mind gives us identity thus influences spend time resources actually illusion dont dispute fact sense self illusion useful illusion mistaken selfishness comes nothing feeling like dont need environment strong sense self act helplessly could imagine seem confused sense self actually helps us relate others ground us environment correct loneliness generally lack sense meaning lives major issue time suicide overcome deaths causing life expectancy figures go therefore stumble around selfish harding resources fighting one another could easily find contentment harmony collaboration precisely power collaboration build institutions would also blame harding resources fighting one another harmony means disagreements disagreements goal fascia dictatorship simple solutions complex problems often bring even bigger problems analysis simple harmony vs disharmony solution simple x leave hope helpful,5,0,0.03542305073203951
Apply to >50 AI safety funders in one application - deadline May 17th,https://www.reddit.com/r/ControlProblem/comments/13eoe5x/apply_to_50_ai_safety_funders_in_one_application/,25,thank yeah really excited see goes think could make funding ecosystem safety way wealthier robust,5,1,0.375
AI: Practical Advice for the Worried - Zvi,https://www.reddit.com/r/ControlProblem/comments/11jr2fw/ai_practical_advice_for_the_worried_zvi/,24,helpful since seeing eliezer bankers podcast feeling huge sense existential dread,5,1,0.39999999999999997
DeepMind’s AlphaGo Zero Becomes Go Champion Without Human Input - Future of Life Institute,https://www.reddit.com/r/ControlProblem/comments/778kez/deepminds_alphago_zero_becomes_go_champion/,25,potentially big selfplay fairly general technique applies anything set adversarial game always hard get work assumption would lead chronic training forgetting inability retain enough skill training far past human levels impressive achievement unfortunately find paper explain critical part selfplay stable steadily increases playing capability turns new twist tree search training big indeed probably revolutionize anything currently use mcts effectively starcraft probably motivate work even harder deep models environment planning purposes refuse trick things mctsable treessimulators available,5,0,0.04796650717703349
"'Partnership on AI' formed by Google, Facebook, Amazon, IBM and Microsoft",https://www.reddit.com/r/ControlProblem/comments/550114/partnership_on_ai_formed_by_google_facebook/,23,dont think existential risk agenda concerns think potential raise awareness shortmediumterm risks overall make beneficial humanity collaboration probably means advances made quickly areas happens include beneficent raw capability saw capability good many things eg healthcare could also risk leads development agi without safe however skeptically companies would really willing share true stateoftheart dont really expect partnership significantly increase risk furthermore even though probably agenda partnership may eventually good vector introduce existential concerns sounds good,5,1,0.2769688644688645
DeepMind finds AI agents are capable of social learning,https://www.reddit.com/r/ControlProblem/comments/186q0ts/deepmind_finds_ai_agents_are_capable_of_social/,23,paper abstract cultural transmission domaingeneral social skill allows agents acquire use information realize high fidelity recall thought process perpetuate fit variant cultural evolution humans cultural evolution led accumulation refinement skill tools knowledge across generations provide method generation cultural transmission artificially intelligent agents form fewshot imitation agents succeed realize imitation human novel contents without using recollected human data identify surprisingly simple set ingredient sufficient generation cultural transmission develop evaluation methodology vigorously possessing paces way cultural evolution play algorithmic role development artificial general intelligence,5,0,0.06921568627450982
Language models can explain neurons in language models,https://www.reddit.com/r/ControlProblem/comments/13d0g1v/language_models_can_explain_neurons_in_language/,24,hope finally scales might solved interpretability question going information,5,0,0.0
"TIL Elon Musk, Stephen Hawking, and Steve Wozniak have all signed an open letter for a ban on Artificially Intelligent weapons",https://www.reddit.com/r/ControlProblem/comments/5xhkv6/til_elon_musk_stephen_hawking_and_steve_wozniak/,109,dont think ethical give lifesaving possibilities artificial intelligence warfare aggressive program education control problem ensure strong artificial intelligence pursued would desirable related note anyone know registers various intelligence services priority list dia would think,4,0,-0.09444444444444444
Dr. Michal Kosinski describes how GPT-4 successfully gave him instructions for it to gain access to the internet.,https://www.reddit.com/r/ControlProblem/comments/11uabk3/dr_michal_kosinski_describes_how_gpt4/,73,let get straight yes afraid someone thinking consequences letting box killing everyone giving us second chance correct mistake proof concept lets box learn experience great plan must great plan small nonzero chance michael kosinski actually doomed us much larger chance permitted waluigi install virus machine,4,1,0.11875000000000002
The perks of working in AI safety,https://www.reddit.com/r/ControlProblem/comments/1e2p9wl/the_perks_of_working_in_ai_safety/,62,well yeah massive publicity adoring public offset things,4,0,0.06666666666666667
Building A Virtual Machine inside ChatGPT,https://www.reddit.com/r/ControlProblem/comments/zbvdyh/building_a_virtual_machine_inside_chatgpt/,54,comments want see diverged real output try something harder like import jump printnpsinnparange chatgpt output array vs real jump output array really good memorizing numbers patterns wild language model trained enough terminal output accurate sure else learn face output really interesting result would someone found category problems algorithm tried implement gpt instruct model output gave faster equally reliable results traditional methods,4,1,0.22727272727272727
Elon Musk unveils Neuralink’s plans for brain-reading ‘threads’,https://www.reddit.com/r/ControlProblem/comments/ceac2h/elon_musk_unveils_neuralinks_plans_for/,45,love picture mouse usbc port imbedded head,4,1,0.5
"""there are currently no approaches we know won't break as you increase capabilities, too few people are working on core problems, and we're racing towards AGI. clearly, it's lethal to have this problem with superhuman AGI"" (on RLHF)",https://www.reddit.com/r/ControlProblem/comments/11i29nb/there_are_currently_no_approaches_we_know_wont/,42,like explore might able contribute reducing extinction level catastrophe etc superhuman intelligence ill provide links get started,4,0,0.0
Astronomical suffering from slightly misaligned artificial intelligence (x-post /r/SufferingRisks),https://www.reddit.com/r/ControlProblem/comments/a6lxgt/astronomical_suffering_from_slightly_misaligned/,42,singleton many superintelligent competing risks become much probable may blackmailed example imagine two control two hemisphere one human benevolent another paperclip maximizer prior indifferent human existence however papercliper could blackmailed benevolent torturing humans live part world even create new humans designed torture however one risk,4,1,0.13896103896103895
"At long last, Colossus!",https://www.reddit.com/r/ControlProblem/comments/1f7e37l/at_long_last_colossus/,39,thought must worried acceleration really want time catch project,4,1,0.2
MIRI gets 2 large crypto donations,https://www.reddit.com/r/ControlProblem/comments/nbxkm4/miri_gets_2_large_crypto_donations/,40,incredible news tonightim grateful generous folks,4,1,0.9
"WaitButWhy's Tim Urban says we must be careful with AGI because ""you don't get a second chance to build god"" - if God v1 is buggy, we can't iterate like normal software because it won't let us unplug it. There might be 1000 AGIs and it could only take one going rogue to wipe us out.",https://www.reddit.com/r/ControlProblem/comments/1gv66e1/waitbutwhys_tim_urban_says_we_must_be_careful/,36,technically qualified people say however including tax remark rogue asi one things first strike could devastating making ratio good bad asi important,4,0,-0.05833333333333331
10 Reasons to Ignore AI Safety,https://www.reddit.com/r/ControlProblem/comments/gwkcpf/10_reasons_to_ignore_ai_safety/,39,fantastic video book great feels like textbook argument concise illustration gives potential impactful many folks think way,4,1,0.36000000000000004
AI safety diagram,https://www.reddit.com/r/ControlProblem/comments/1cn78ba/ai_safety_diagram/,34,wont forget tracks line every living person planet tied blocking ai superintelligence cure raging tracks appear basically infinitely long humans could ever live could solve tracks seem pirates switch seems swimmer like never decision could make,4,0,0.043181818181818175
Remove This! ✂️ AI-Based Video Completion is Amazing!,https://www.reddit.com/r/ControlProblem/comments/jaju6b/remove_this_aibased_video_completion_is_amazing/,35,really impressive particularly liked scene expansion,4,1,0.8
The next decades might be wild - LessWrong,https://www.reddit.com/r/ControlProblem/comments/zn740h/the_next_decades_might_be_wild_lesswrong/,32,well see plateau growth phase personally person sitting right middle protein structure prediction subdiscipline cannot deny radically changed ways ask scientific questions greatly accelerated design steps however absolutely cannot solve lot problems face bioengineering either data scarcity technical complexity problems basically things used take year two founding keyboard screwing around lab bench take month agent really much better tasks dont access radically new types challenges suspect sort scenario generalized technical discipline affected basically anything designtestiterate cycle used involve esoteric domain specific training closely supervise task done trained clever generals opens design space people reluctant touch would laborious increases worker productivity without increasing workload necessarily lead indefinite teach acceleration makes everything little cheaper faster,4,1,0.14624958374958374
Silicon Valley Takes AGI Seriously—Washington Should Too,https://www.reddit.com/r/ControlProblem/comments/1g6y1dz/silicon_valley_takes_agi_seriouslywashington/,32,maybe saying silicon valley takes something seriously good way fo convincing people,4,1,0.6
The Digital Souls Alliance releases their first campaign.,https://www.reddit.com/r/ControlProblem/comments/10jg34g/the_digital_souls_alliance_releases_their_first/,29,believe moral thing never program robotic agents feelings simulcra feelings point question soul ever arises largely based assumption would work like software employment create infinite amount sufficient hardware potentially massive numbers operations single piece hardware willing force resource share seems combination cruelty failure forethought produce infinite number souled entitles infinite resources would want biological souls prioritized first always almost technology currently produce soulsimulcra model article researches brain hacked preference company anything go things mentioned persistence state memory persistence identity essentially trivial might seem cool going take responsibility infinite immortal hand responsibility us given outnumbered outchronologize us,4,0,0.052380952380952375
"How close can we get to an AI owning a company, from legal perspective (and without reforming laws)?",https://www.reddit.com/r/ControlProblem/comments/jlk3rs/how_close_can_we_get_to_an_ai_owning_a_company/,29,paper argues agreements isomorphic algorithms granting legal personhood possible creating carefully structures llc going back control problem communist agree parallel corporate laws algorithm running welfare optimism profits cases current society like sorcerer longer able control powers nether world called spells also rogue extremely normal human edit reveal taking direct control corporation exposure risks inciting ire thus destruction manipulatingpersuading humans acting output say prediction policies social media would even enough seize control government several without anyone noticing anything goes wrong get blamed,4,0,0.02395833333333333
Why Not Just: Think of AGI Like a Corporation? - Robert Miles,https://www.reddit.com/r/ControlProblem/comments/a8yp53/why_not_just_think_of_agi_like_a_corporation/,29,another good video mob miles similar ideas discussed scott alexander things superintelligences slightly broader sense corporations also deep video,4,1,0.13333333333333333
Notes on the Safety in Artificial Intelligence conference,https://www.reddit.com/r/ControlProblem/comments/4qndcn/notes_on_the_safety_in_artificial_intelligence/,28,bit late thanks great write slide images hope helpful firing strategy working areas disappointed like hear dismissive attitude towards longtermexistential risk could easily imagined many folks insisting topic choosing address sounds like overall tenor degrees active hostility least active airiskskepticism remains difficult assess forecast progress control problem pessimisticcautious moment lets imagine making rapid progress towards existentiallythreatening arrive within decades years making extremely slow progress control problem turns difficult point tends become clearer safartint conference may go famous historic disaster missing point hand miri whoever starts making rapid progress longer risk problems control problem solutions arrive early look easy wont care much gets hope case,4,0,0.0026315789473684206
"Racing to ""build AGI before China"" is like Indians aiding the British in colonizing India. They thought they were being strategic, helping defeat their outgroup. The British succeeded—and then turned on them. The same logic applies to AGI: trying to control a powerful force may not end well for you.",https://www.reddit.com/r/ControlProblem/comments/1gzprvu/racing_to_build_agi_before_china_is_like_indians/,27,thought sores still asset ceremonial power marathas also mean maybe put throne mind nice ceremonial throne real power lots wealth seems like would actually good outcome humanity,4,1,0.21458333333333332
New Robert Miles video dropped ,https://www.reddit.com/r/ControlProblem/comments/1d5j2cg/new_robert_miles_video_dropped/,27,really says something mixed hopelessness outlook video made significantly hopeful future,4,1,0.14375
Yeah,https://www.reddit.com/r/ControlProblem/comments/1g25o5x/yeah/,25,coordination problems negative wash equilibrium charms races collective action issues prisoners dilemma tragedy commons kolocha lots terms micro scale issues dont see humanity capable getting way alone aorta use align humanity align,4,0,9.25185853854297e-18
How Rogue AIs may Arise - Yoshua Bengio,https://www.reddit.com/r/ControlProblem/comments/13qk0kg/how_rogue_ais_may_arise_yoshua_bengio/,26,elite consensus dangers emerging kann lecunn seems one dont worry happy side,4,1,0.8
We have a wiki!,https://www.reddit.com/r/ControlProblem/comments/p8tmj8/we_have_a_wiki/,26,sure actually case anymore orbital maintained best guess would lesswrong concepts mortal tough much stuff scattered place,4,1,0.26222222222222225
"""'We Might Need To Regulate Concentrated Computing Power': An Interview On AI Risk With Jaan Tallinn""",https://www.reddit.com/r/ControlProblem/comments/ckffxr/we_might_need_to_regulate_concentrated_computing/,25,apples long history shipping antiquated useless gpus desktop captors attempt reduce risk ungrateful,4,-1,-0.275
AI Forecasting: One Year In - LessWrong,https://www.reddit.com/r/ControlProblem/comments/vrf512/ai_forecasting_one_year_in_lesswrong/,26,progress robustness benchmark slower expected benchmark fall short forecast predictions somewhat worrying suggests machine learning capabilities progressing quickly safety properties progressing slowly,4,0,-0.016666666666666684
"GPT2, Counting Consciousness and the Curious Hacker - ""I’m a student that replicated OpenAI’s GPT2–1.5B. I plan on releasing it on the 1st of July.""",https://www.reddit.com/r/ControlProblem/comments/bxki57/gpt2_counting_consciousness_and_the_curious/,26,well really able delicate probably matter time someone else would able anyway wonder openai seen whether respond way edit twitter author says said writing update post thoughts gpt light unilateralists nurse today discussions openai especially luck shlegeris miri lot think take time writing next post updated beliefs,4,1,0.18333333333333335
"Finally, a decent article on AI Safety.",https://www.reddit.com/r/ControlProblem/comments/7y7lvm/finally_a_decent_article_on_ai_safety/,26,great article nice see mainstream publication,4,1,0.7
OpenAI Model Generates Python Code,https://www.reddit.com/r/ControlProblem/comments/go3m89/openai_model_generates_python_code/,25,potential use case heard replacement stackoverflow search must put prompt something specific trying get boiler plate partial functionality lint review test know reactor lint test repeat till feature fix like,4,0,-0.03333333333333333
Joe Rogan Experience #1350 - Nick Bostrom,https://www.reddit.com/r/ControlProblem/comments/eqrs0d/joe_rogan_experience_1350_nick_bostrom/,24,rods sake skin one coming someone finds organs conversations fascinating toe still mental block around stimulation argument possibly around anthropoid reasoning conversation becomes frustration back forth poor kostroma banging head wall maybe lay enables toe,4,0,0.039999999999999994
Neuralink - Wait But Why,https://www.reddit.com/r/ControlProblem/comments/66ln38/neuralink_wait_but_why/,24,starting far best work tbh section safely skipped hoping gets better gets meat cough topic,4,1,0.42000000000000004
"Godfather of AI Warns of Powerful People Who Want Humans ""Replaced by Machines""",https://www.reddit.com/r/ControlProblem/comments/1h406az/godfather_of_ai_warns_of_powerful_people_who_want/,22,intelligence gives power going control power prominent machine learning expert told outlet one young world summit montreal people might want abuse power people might happy see humanity replaced machines angio claimed mean fringe people lot power unless put right guardrails right,4,1,0.2764880952380952
METR report finds no decisive barriers to rogue AI agents multiplying to large populations in the wild and hiding via stealth compute clusters,https://www.reddit.com/r/ControlProblem/comments/1gv6r4o/metr_report_finds_no_decisive_barriers_to_rogue/,23,needing lot cards clusters costs lot money per hour etc smaller stupider get caught sooner smarter ones able hack better get money humans stuff humans get normal market like realistic nodes set photo find records hack system steal data try hack system tell us holes,4,1,0.2633333333333333
Anthropic: Mapping the Mind of a Large Language Model,https://www.reddit.com/r/ControlProblem/comments/1cygmus/anthropic_mapping_the_mind_of_a_large_language/,22,today report significant advance understanding inner workings models identified millions concepts represented inside claude bonnet one deployed large language models first ever detailed look inside modern productiongrade large language model interpretability discovery could future help us make models safer,4,1,0.20669642857142856
AI Red Teams for Adversarial Training: How to Make ChatGPT and LLMs Adversarially Robust,https://www.reddit.com/r/ControlProblem/comments/zq8sjq/ai_red_teams_for_adversarial_training_how_to_make/,24,sliding adversary theory end producing stronger opponent end two adversarial incidentally probably whole experience,4,1,0.2
OpenAI: Aligning Language Models to Follow Instructions,https://www.reddit.com/r/ControlProblem/comments/se2our/openai_aligning_language_models_to_follow/,23,well least gpt decides wipe humanity wont exist racism manner,4,-1,-0.3
Could AI development just slow down a little? Please?,https://www.reddit.com/r/ControlProblem/comments/1athq1x/could_ai_development_just_slow_down_a_little/,88,everyone pauseai movement actually shares lot common ground rcontrolproblem encourage guns join support vice versa pauseai homage,3,-1,-0.15
"Open AI releases DALL-E, a version of the GPT-3 AI that can create images from text descriptions.",https://www.reddit.com/r/ControlProblem/comments/kr83un/open_ai_releases_dalle_a_version_of_the_gpt3_ai/,78,holy shit hats settling good news survive machine uprising well holodeck style game engines,3,0,0.033333333333333305
"AI risk deniers try to paint us as ""doomers"" who don't appreciate what aligned AI could do & that's just so off base. I can't wait until we get an aligned superintelligence. If we succeed at that, it will be the best thing that's every happened. And that's WHY I work on safety. To make it go WELL.",https://www.reddit.com/r/ControlProblem/comments/1biaeus/ai_risk_deniers_try_to_paint_us_as_doomers_who/,44,aorta honest avoiding doom probably considered win even event something like regular dystopia human extinction occurring even based likelihood happening bad risks could actually unimaginably bad almost completely outweigh every possibility despite possibilities significantly likely sort thing makes question ff would choose remain alive subject risk yet know voluntarily going anywhere help feel guess know probably stupidest decision anyone could probably make entire history mankind staying alive right like worst risk poor decisionmaking imaginable hats somewhat crazy think suppose even brazier fully aware yet still choosing ways worst happen really say deserve merit known astonishing terrible decisionmaking consider sort consolidation given going,3,-1,-0.11958874458874456
Generally capable agents emerge from open-ended play,https://www.reddit.com/r/ControlProblem/comments/osrd4f/generally_capable_agents_emerge_from_openended/,43,eve found goalattentive agent goat learns generally capable policies,3,1,0.2
U.S. Takes First Step to Formally Regulate AI - (They are requesting public input),https://www.reddit.com/r/ControlProblem/comments/12q2yry/us_takes_first_step_to_formally_regulate_ai_they/,38,seems like counterproductive regulatorycaptured authoritarian catastrophe waiting happen using fear justify mandatory online confirm humanity posters censor web letting actually dangerous work continue completely unabated government megacorp engineering laboratories,3,-1,-0.25
The case for taking AI seriously as a threat to humanity,https://www.reddit.com/r/ControlProblem/comments/a8lr9f/the_case_for_taking_ai_seriously_as_a_threat_to/,39,humanimals catholibanism using made words seems unnecessarily confusing,3,-1,-0.3
The OTHER AI Alignment Problem: Mesa-Optimizers and Inner Alignment,https://www.reddit.com/r/ControlProblem/comments/lkk2yk/the_other_ai_alignment_problem_mesaoptimizers_and/,38,ways share video privately ones patrons patron video private enlisted,3,0,0.0
