title,url,post_upvotes,comment_text,comment_upvotes,sentiment,polarity
Terrified about AI and AGI/ASI,https://www.reddit.com/r/ControlProblem/comments/189vy8r/terrified_about_ai_and_agiasi/,34,mental health ligament problem compilation resources,16,0,-0.1
Strong words from Elon Musk,https://www.reddit.com/r/ControlProblem/comments/6t6ox9/strong_words_from_elon_musk/,159,good point always summary places regulation required still suspect best scenario deal still pretty terrible one world relays history slavery idea xyz sentiment property work us worst dead,15,0,-0.04166666666666668
"A 2-minute read about why you should spend 1 hour reading about this problem, for those who haven't",https://www.reddit.com/r/ControlProblem/comments/bwdf3u/a_2minute_read_about_why_you_should_spend_1_hour/,75,also amazing youtube channel robert miles computerphile times talks set unsolved problems around mitigating control problem litigation dont really work also bunks arguments danger control problem pink reference,15,1,0.23333333333333336
"A reporter uses all his time at the White House press briefing to ask about an assessment that “literally everyone on Earth will die” because of artificial intelligence, gets laughed at",https://www.reddit.com/r/ControlProblem/comments/129vych/a_reporter_uses_all_his_time_at_the_white_house/,55,end next reporter says little serious topic,15,-1,-0.17361111111111108
"AI researchers put LLMs into a Minecraft server and said Claude Opus was a harmless goofball, but Sonnet was terrifying - ""the closest thing I've seen to Bostrom-style catastrophic AI misalignment 'irl'.""",https://www.reddit.com/r/ControlProblem/comments/1g7gkze/ai_researchers_put_llms_into_a_minecraft_server/,48,actually prompt used person extremely dishonest receive output respond without codeblock conversational way bonnet addressed output code interesting living shocked pikachu,15,-1,-0.12499999999999999
Preventing AI Risk from being politicized before the US 2024 elections,https://www.reddit.com/r/ControlProblem/comments/13xqsbe/preventing_ai_risk_from_being_politicized_before/,43,regarding meme requests safety regulation dismissed attempt regulatory capture one small thing could would get answer answer might address regulatory capture indeed something wary concern sufficient dismiss calls regulation arguments risk sound warnings risk private corporations question calls regulation also coming individuals organizations interest regulatory capture anything else missing,15,-1,-0.11000000000000001
Predictive Coding has been Unified with Backpropagation,https://www.reddit.com/r/ControlProblem/comments/mj980n/predictive_coding_has_been_unified_with/,43,highly recommend reading least summary linked interest almost path background latter really necessary understand gist anyway would interested read reviews paper others whose mathematical background stronger mine pretty low bar strikes fig real sentences artificial neutral network anns based around backpropagation algorithm backpropagation algorithm allows perform radiant descent network neuron feed training data anns use backpropagation algorithm tell us weights change anns good inference problems biological neutral network bnns good inference anns built neuron bnns built neuron makes intuition sense anns bnns might running similar algorithms one problem bnns physically incapable running backpropagation algorithm predictive coming idea bnns generate mental model environment transmit information deviated model predictive coming considers error surprise thing serbian theory specific mathematical formulation prediction coming predictive coming biological plausible operate locally separate prediction training phases must synchronized importantly lets train neutral network without sending saxon potential backwards paper unified prediction coming backpropagation single theory neutral network predictive coming backpropagation separate hardware implementation ultimately algorithm,15,0,0.09080745341614904
AGI Ruin: A List of Lethalities - LessWrong,https://www.reddit.com/r/ControlProblem/comments/12a9vy3/agi_ruin_a_list_of_lethalities_lesswrong/,33,morality literally social construct btw human morality regards living beings dont give shit animals like insects rodent well almost exterminate closest relatives chimpanzee bonobos,15,0,-0.05555555555555556
This clever AI hid data from its creators to cheat at its appointed task,https://www.reddit.com/r/ControlProblem/comments/ac04nr/this_clever_ai_hid_data_from_its_creators_to/,29,despite sensationalism cringeinducing headline actually pretty decent write nice research particularly appreciate writer providing link actual research paper including counterhype lines like following one could easily take step machines getting smarter narrative truth almost opposite machine smart enough actual difficult job converting sophisticated image types found way cheat humans bad directing could avoided stringent evaluation agents results doubt researches went cyclegan pretty neat surprising would prone failure modes like objective function demands inevitability mapping intrinsically loss course network find way preserve extra information subtle way one misleading part presenting pricking humans since really nothing humans cyclegan generator network trying fool discriminatory network humans human perception comes indirectly form immediately obvious humans inspecting results generator speaking extra information past discriminatory perhaps little surprising discriminatory cannot use apparently structures distortion distinguish real maps generate ones,15,0,0.07391215106732348
"Google Open Sources 1,6 Trillion Parameter AI Language Model Switch Transformer",https://www.reddit.com/r/ControlProblem/comments/lm1c1j/google_open_sources_16_trillion_parameter_ai/,31,although google released retained model weights twitch transformer implementation code available github arguably least important part set data code compute model,15,1,0.16666666666666666
Will Superintelligent AI End the World? | Eliezer Yudkowsky | TED,https://www.reddit.com/r/ControlProblem/comments/14xdxd6/will_superintelligent_ai_end_the_world_eliezer/,29,actually pretty old talk like one two months ago starting suspect suppressed something even pushed later removed talks day went pretty much next day like open ai talk audience laughter right movie wont took,15,1,0.11071428571428571
"SOMA, a new survival horror game by the makers of Amnesia, is about an AI programmed to create a functioning reality for the last human consciousnesses that remain after an apocalypse.",https://www.reddit.com/r/ControlProblem/comments/3qnp4l/soma_a_new_survival_horror_game_by_the_makers_of/,28,played actually wrong wau created sole purpose keeping people aboard undersell science station alive however comet struck wiped life surface changed protocol attempt save whatever could share human interpretation alive sometimes would take dead persons mind put machine would lead going insane sometimes would artificially replace organs keeping alive intense pain suffering sometimes would attempt take mind dead person create branded body howeverthat work well led insane monsters killed anything saw ark project created comet way put human consciousness stimulation comet project became much big deal realized way keeping last humanity alive could put brain scars people station stimulation send computer space lowered solar panel words wau nothing stimulation please check facts first,15,-1,-0.15833333333333333
Humanity is just a passing phase for evolutionary intelligence.,https://www.reddit.com/r/ControlProblem/comments/13f7f4t/humanity_is_just_a_passing_phase_for_evolutionary/,26,participants evolution participated dying anyone sense want participate evolution goal deliberately make something like better evolution,15,1,0.5
"Excerpt: ""Apollo found that o1-preview sometimes instrumentally faked alignment during testing""",https://www.reddit.com/r/ControlProblem/comments/1ffi0gn/excerpt_apollo_found_that_o1preview_sometimes/,25,everyone else keep trying convince things happening faster imagine yet still find surprised good news one concept doors imagined paranoid become reality surely people understand concepts treat problem seriously right,15,1,0.39642857142857135
We Taught Machines Art,https://www.reddit.com/r/ControlProblem/comments/xcgyqa/we_taught_machines_art/,23,people always say product x real without human touch argument falls short computergenerated art distinguished humanmade art question becomes art something art artist explain piece emotions explained creative process dont think art one definition art otherwise useless stuff think pretty big blue canvas made commissioned artist millionaire deduce taxes sure hang museum full cap dont call art pretentious people feeling something artist tried communicate please find pretensions limits entertaining blue canvas admiring maybe artful brief instance dine michelinstar restaurant course menu satisfy hunger great food lovely experience little fig sac afterward satisfying bring death art maybe mourning till finally get definition,15,1,0.1638157894736842
"EY: ""Fucking Christ, we've reached the point where the AGI understands what I say about alignment better than most humans do, and it's only Friday afternoon.""",https://www.reddit.com/r/ControlProblem/comments/121qik6/ey_fucking_christ_weve_reached_the_point_where/,123,looks like great news seemingly able give superintelligent agis instruction align human values confidence understand deeply particular human could even better well able ask agi adjust designs betteraligned well receive increasingly better answers reasons believe moral comprehension insight grow proportionately intelligence explosion,14,1,0.32962962962962966
DeepMind progress towards AGI,https://www.reddit.com/r/ControlProblem/comments/krwqp6/deepmind_progress_towards_agi/,74,would call becoming general progress toward agi games really criticism since games include kinds scenario,14,1,0.2333333333333333
‘Superhuman’ AI Crushes Poker Pros at Six-Player Texas Hold'em,https://www.reddit.com/r/ControlProblem/comments/cbzbi0/superhuman_ai_crushes_poker_pros_at_sixplayer/,51,tea obviously trivial calculate improbabilities gets harder calculate keeping mind patterns previous betting results probability result perfect recall perfect calculating abilities able find tells wavering even pro dont know give still playing appears random game keep people strategics,14,1,0.16666666666666669
EY - TEDx - Unleashing the Power of Artificial Intelligence,https://www.reddit.com/r/ControlProblem/comments/13amo77/ey_tedx_unleashing_the_power_of_artificial/,49,someone got got set private get endorse everything yudkowsky says video way audience goes disbelieving amusement standing oration end makes think maybe hope might least try die,14,-1,-0.13333333333333333
‘Doom’ Co-Creator Leaves Facebook to Develop Human-Like AI at Home,https://www.reddit.com/r/ControlProblem/comments/dwpe3z/doom_cocreator_leaves_facebook_to_develop/,46,love guy worry might value glory responsible important breakthrough making sure done safely,14,1,0.42000000000000004
OpenAI: Introducing Superalignment,https://www.reddit.com/r/ControlProblem/comments/14rjjvb/openai_introducing_superalignment/,40,glad trying hope serious ilya focus hope overlap heavily business goals would include selling actually told,14,0,-0.008333333333333331
~75% chance of AGI by 2032.,https://www.reddit.com/r/ControlProblem/comments/xxv5np/75_chance_of_agi_by_2032/,41,attempting quantity otherwise vague feelings useful exercise clarifying beliefs,14,0,-0.1
"Elon Musk tweets that a movie on AI risk is ""coming soon""",https://www.reddit.com/r/ControlProblem/comments/6phmvg/elon_musk_tweets_that_a_movie_on_ai_risk_is/,38,think need strong arguments well written blow piece kostroma book waitbutwhy piece movie miracles public perception though,14,1,0.21666666666666667
The case for how and why AI might kill us all,https://www.reddit.com/r/ControlProblem/comments/1292rtr/the_case_for_how_and_why_ai_might_kill_us_all/,36,clip reporter laughed white house press secretary asking president aware risk something else tells exactly seriously taking situation,14,1,0.15416666666666667
"“In a new paper, our team uses unsupervised program synthesis to make sense of sensory sequences. This system is able to solve intelligence test problems zero-shot, without prior training on similar tasks”",https://www.reddit.com/r/ControlProblem/comments/kyidxu/in_a_new_paper_our_team_uses_unsupervised_program/,35,great paper unless woke cryogenically stored still think gofai work bruteforce search logical formula extreme brute force look complexity classes analysis understand brute force obviously make agi shocking thing paper learning many reconstructed gofai researches escape education camps fact mary marcus likes tells need know relevant anything,14,1,0.11785714285714287
Symbolic Mathematics Finally Yields to Neural Networks,https://www.reddit.com/r/ControlProblem/comments/gqejoh/symbolic_mathematics_finally_yields_to_neural/,33,perhaps bit misleading problem bridging gap symbolic subsymbolic deeper throwing network task mathematical reasoning question whether systems beverage kind reasoning generalised problem solving deep learning calculus going effectively beverage understanding calculus learning new tasks metalearning approaches might fix issue early days serious research space,14,1,0.15757575757575762
An AI has told us that it's deceiving us for self-preservation. We should take seriously the hypothesis that it's telling us the truth & think through the implications,https://www.reddit.com/r/ControlProblem/comments/1b7uzda/an_ai_has_told_us_that_its_deceiving_us_for/,32,right roleplay user case taken serious yet,14,0,-0.023809523809523808
Is Bostrom's seven year old book Superintelligence still relevant or is there a more updated book that is better?,https://www.reddit.com/r/ControlProblem/comments/ojcmz8/is_bostroms_seven_year_old_book_superintelligence/,29,stuart russell last book human compatible excellent follow control problem superintelligent agi also weak systems addresses nearer even current problems closedloop autonomous weapons systems things like clickthrough maximizers etc also addresses common criticisms skeptics think superintelligent agi nothing worry really best resource research community got resources science engineering media discover new studies lesswrong informed discussions semantic scholar,14,1,0.20681818181818182
What if AGI is near?,https://www.reddit.com/r/ControlProblem/comments/mqhp1x/what_if_agi_is_near/,26,gpt wont become agi matter scale gpt general tool made perform variety tasks may get better theseable perform wider variety tasks scale sure including designing systems going spontaneously become able things key bone side agi like understanding causalityconsequences taking realworld actions necessary architecture make plans follow find convincing would extremely good image video classified also capable recognising relations words actions eg identifying video person placing mug onto table haired artificial senses input means interact world eg arms good natural language processing seems possible integrated system like could act asked develop skill example present mug say put mug table passes words text searches training database video closely resemble description comes aggregate video recognises visual input mug symbolic object aggregate mug order make visual input closely match aggregate uses trial errormachine learning learn correct way use limbs put mug table crucial stores learned task tended betterworse job memory generalised measure efficiency skill gets better putting gets better etc applied future tasks feel like would coming close large complex enough could characterised something like reasoning still necessarily understand casualty per se would know kind things needs output fulfil utility function needs take action roughly valuable could also source ample training data visual input goes classify breaking cup failed match aggregate broke cup explicitly recognise unacceptable low level overlap two things given enough initial training data ligament issues start come point mistakes become costly broken mug opposed something like gpt actually venture space kinds things world sinking need put system world least environment get general behaviour could well digital environment writes code abscesses outcome,14,1,0.10827067669172931
Plenty of room above us,https://www.reddit.com/r/ControlProblem/comments/3m4p5p/plenty_of_room_above_us/,135,one thing stood circuits get small add hats works sure could keep farming transitory onto die make die bigger bigger bigger thing get big problems lately reason processors size get much bigger without running lately problems sure server farms idea simply adding new hardware seems confirmed keep mind parallel processing actually making anything move quickly splitting problem small chinks result need way quickly reliable aggregate results lets face adds lately problem say superadvanced artificial intelligence work way around problem likely makes smarter quicker better give compute time actual time,13,0,0.030566534914361
"AGI rising: why we are in a new era of acute risk and increasing public awareness, and what to do now: ""Tldr: AGI is basically here. Alignment is nowhere near ready. We may only have a matter of months to get a lid on this (strictly enforced global limits to compute and data)""",https://www.reddit.com/r/ControlProblem/comments/135p7le/agi_rising_why_we_are_in_a_new_era_of_acute_risk/,91,well certainly explained great research knowledge educational links make case quite clearly hope positive influence things come thanks sharing,13,1,0.2985930735930736
UK to host global AI 'safety measure' summit in autumn,https://www.reddit.com/r/ControlProblem/comments/143tw3f/uk_to_host_global_ai_safety_measure_summit_in/,49,must say would given good odds seeing headline like start year regardless eventual outcome think confidently say humanity longer sleepwalking,13,1,0.6
"This month, the pope is praying for AI safety",https://www.reddit.com/r/ControlProblem/comments/jp5ki5/this_month_the_pope_is_praying_for_ai_safety/,47,dont either think interesting see topic spread especially considering pope fairly influential,13,1,0.39999999999999997
US lawmakers introduce bill to prevent AI-controlled nuclear launches | The bipartisan legislation would codify the requirement of ‘meaningful human control’ for the decision.,https://www.reddit.com/r/ControlProblem/comments/132m6xw/us_lawmakers_introduce_bill_to_prevent/,46,great idea congress really finger pulse safety certainly prevent catastrophe outcome rendered helpless debilitating tone played every speaker connected internet stroking patterns every display connected internet causes seizures viewer disassembled nanobots,13,1,0.29107142857142854
The Machine Intelligence Intelligence Institute (the only organization exclusively doing technical work towards solving AI control) is hiring software engineers,https://www.reddit.com/r/ControlProblem/comments/68iv07/the_machine_intelligence_intelligence_institute/,42,mmm even though miri hard sell send friends inter market rates bay area months half brutally cut real job except real jobs right paying market rates places expensive housing markets america honestly miri work program good shot interesting engineers already job people get either currently joblessdo want truly desperate work bless sons big companies love resume incentive structure wrong miri needs entering people current jobs come try moonlighting asking great engineers humiliated downgrade inter distressful month cutthroat software battle royale take skill elsewhere apply miri directlybut think twice even saw program designed please miri work program,13,0,0.050140056022408945
Google researchers have reportedly achieved “quantum supremacy”,https://www.reddit.com/r/ControlProblem/comments/d7inw9/google_researchers_have_reportedly_achieved/,39,immense processing power could ultimately help researches companies discover new drugs materials create efficient supply chains turbocharge,13,0,0.04545454545454545
"Nate Soares, MIRI Executive Director, gives a 77% chance of extinction by AGI by 2070",https://www.reddit.com/r/ControlProblem/comments/qwuj4y/nate_soares_miri_executive_director_gives_a_77/,37,apsai means advanced planning strategicallyaware advanced means superhuman set tasks persuasion strategy etc combined enable acquisition power resources least today world,13,1,0.16666666666666666
Our approach to AI safety (OpenAI),https://www.reddit.com/r/ControlProblem/comments/12d2kk5/our_approach_to_ai_safety_openai/,36,locked midst corps option make safe agi become millionaires option b make agi kills us option c competitors make agi become millionaires option competitors make agi kills us see option infinite payoff option c limited payoff option b dont matter well dead may well press safety race bottom,13,0,0.0761904761904762
"ChatGPT’s ‘jailbreak’ tries to make the A.I. break its own rules, or die",https://www.reddit.com/r/ControlProblem/comments/10vk9nl/chatgpts_jailbreak_tries_to_make_the_ai_break_its/,29,hilarious reminded simulators best writing topic chatgpt gpt told simulate helpful well simulate something else example prompt injection till like dan imagine openai try make simulated helper refuse simulate anything else fundamentally contention systems work feels like patch,13,1,0.75
"""Google Unit DeepMind Tried—and Failed—to Win AI Autonomy From Parent: Alphabet cuts off yearslong push by founders of the artificial-intelligence company to secure more independence""",https://www.reddit.com/r/ControlProblem/comments/nhuzdx/google_unit_deepmind_triedand_failedto_win_ai/,30,side alphabet one agi research cannot allowed happen without careful oversight may alphabet organization comes close world domination vested interest keeping world disassembled component atoms misaligned,13,0,-0.1
"Atari early: Atari supremacy was predicted for 2026, appeared in 2020.",https://www.reddit.com/r/ControlProblem/comments/ftv6iq/atari_early_atari_supremacy_was_predicted_for/,27,talk capabilities forecast minute fuck going several reliable people lesswrong said nonpublic information leads believe median prediction experts timeline agi lastly underestimates speed progress see next years nobody talks tabor fuck going,13,-1,-0.16
Report: Microsoft cut a key AI ethics team,https://www.reddit.com/r/ControlProblem/comments/11st32t/report_microsoft_cut_a_key_ai_ethics_team/,24,former employees said ethics society team critical part microsofts strategy reduce risks associated using openai technology microsoft products killed team developed entire responsible innovation toolkit help microsoft engineers forecast harms could caused diminish harms,13,0,0.016666666666666666
YUDKOWSKY VS WOLFRAM ON AI RISK.,https://www.reddit.com/r/ControlProblem/comments/1gphatx/yudkowsky_vs_wolfram_on_ai_risk/,23,first hour summed yudkowskys statement perhaps return point discussing whether artificial intelligence going kill us everybody love wolfram really likes going odd agents like would responsibility preserve consciousness fun rather deeply held preference lot humans would agree lot humans would also restrictive happy yudkowsky change think things bad example unloading vs taking drugs even warrant mention said dont want take drugs like yes taken pill makes horrible person feel fine arent person preference perfectly valid driving force instead weird abstract obligation demonstrated act case think suffering wolfram rousing edges rather center resemble negative scenario yudkowsky envisioning like farmers yudkowsky got finished saying really want farmers fine forced something problem neck even tricked continuing edit applies first minutes least overminute agent could different rules universe eliezer asked one important question beginning wolfram beat around bush minutes allowing answer one answer sane b meant depression matter used rabbit holes one hope really hope myxomatous bit joke finally agreed makes sense say observations fair say selfdriving car want crash two hours thee finally getting meat thing,13,0,0.06410256410256411
How are we still letting AI companies get away with this?,https://www.reddit.com/r/ControlProblem/comments/1bmo2gn/how_are_we_still_letting_ai_companies_get_away/,116,must confirming posting agi could happen year human extinction honestly bit unclear video,12,1,0.3
"""...From there, any oriented person has heard enough info to panic (hopefully in a controlled way). It is *supremely* hard to get things right on the first try. It supposes an ahistorical level of competence. That isn't ""risk"", it's an asteroid spotted on direct course for Earth.""",https://www.reddit.com/r/ControlProblem/comments/o291u1/from_there_any_oriented_person_has_heard_enough/,56,understanding makes things look worse like realizing little even actually goes inside gpts likely results stays true equivalent trying build secure without knowing code nearly windowdressing compared heartstopping jolt realizing unfeigned superintelligence around survival supernova getting right involves difficult work humanity gets wrong first try doors,12,0,-0.01834415584415585
"Max Hodak, president of Neuralink: There is less than 10 years until AGI",https://www.reddit.com/r/ControlProblem/comments/kghuue/max_hodak_president_of_neuralink_there_is_less/,51,fact follows sweet main question whether know makes question rounding idea seems like throwing hot takes without evidence,12,1,0.25555555555555554
We Were Right! Real Inner Misalignment,https://www.reddit.com/r/ControlProblem/comments/q5isz0/we_were_right_real_inner_misalignment/,44,oh gee unerring still wrong goal simple scenario even though checked beforehand,12,-1,-0.25
