title,url,post_upvotes,comment_text,comment_upvotes,sentiment,compound
What jobs are 99.9% safe from Al making it obsolete?,https://www.reddit.com/r/ControlProblem/comments/1bht325/what_jobs_are_999_safe_from_al_making_it_obsolete/,594,"""look john connor one says anything best leader human could llamaconnor effective scalable """,19,1,0.8074
meirl,https://www.reddit.com/r/ControlProblem/comments/1gdeg22/meirl/,293,griller completely right treat ya way lol bank predictions relevant,37,1,0.6983
"I think it's implausible that we will lose control, but imperative that we worry about it anyway.",https://www.reddit.com/r/ControlProblem/comments/3ooj57/i_think_its_implausible_that_we_will_lose_control/,260,"one twisted comic think losing control ""implausible"" seems virtually guaranteed",55,-1,-0.3818
"I gave ChatGPT the 117 question, eight dimensional PolitiScales test",https://www.reddit.com/r/ControlProblem/comments/zcsrgn/i_gave_chatgpt_the_117_question_eight_dimensional/,256,"ask questions different order give different results interestingly never used ""absolutely disagree""",24,1,0.625
Strong words from Elon Musk,https://www.reddit.com/r/ControlProblem/comments/6t6ox9/strong_words_from_elon_musk/,165,good point always summary places regulation required still suspect best scenario deal still pretty terrible one world replays history slavery idea xyz sentient property work us worst we're dead,14,-1,-0.8481
People will be saying this until the singularity,https://www.reddit.com/r/ControlProblem/comments/1g0rxqg/people_will_be_saying_this_until_the_singularity/,162,sort agree trash think useful lot things see ever become generalized intelligence without knowledge representation intuition though,8,1,0.8176
Computers won't be intelligent for a million years – to build an AGI would require the combined and continuous efforts of mathematicians and mechanics for 1-10 million years.,https://www.reddit.com/r/ControlProblem/comments/tzcwi9/computers_wont_be_intelligent_for_a_million_years/,154,least people know sound stupid predict million years know say hundred years amount thought,9,-1,-0.5267
Strong AI,https://www.reddit.com/r/ControlProblem/comments/9as0id/strong_ai/,140,teach ethics yes sees humans violating ethics constantly sets teach humans better create world permanent ethical behaviour possible rewarding,26,1,0.872
Plenty of room above us,https://www.reddit.com/r/ControlProblem/comments/3m4p5p/plenty_of_room_above_us/,137,"what's source intelligence difference einstein village idiots mice unit sources criteria ""intelligence"" given also questionable speed neurons factor human's ""intelligence"" compared computers probably problem brain less cm wide huge speed human intelligence ""accidental"" ""temporary"" highly arguable unjustified",14,1,0.2601
"Types of Alignment Paper (Leo Gao, 2021)",https://www.reddit.com/r/ControlProblem/comments/n2i61t/types_of_alignment_paper_leo_gao_2021/,125,hope there's many memes one seemed particularly poignant especially liked bottom left source,16,1,0.7397
"‘Social Order Could Collapse’ in AI Era, Two Top Japan Companies Say …",https://www.reddit.com/r/ControlProblem/comments/1bz3rdt/social_order_could_collapse_in_ai_era_two_top/,124,capitalism function see alternatives assume chaos,14,-1,-0.5719
"EY: ""Fucking Christ, we've reached the point where the AGI understands what I say about alignment better than most humans do, and it's only Friday afternoon.""",https://www.reddit.com/r/ControlProblem/comments/121qik6/ey_fucking_christ_weve_reached_the_point_where/,124,looks like great news seemingly able give superintelligent agis instruction align human values confidence understand deeply particular human could even better we'll able ask agi adjust designs better aligned we'll receive increasingly better answers reasons believe moral comprehension insight grow proportionally intelligence explosion,12,1,0.9732
"DL pioneer Geoffrey Hinton (""Godfather of AI"") quits Google: ""Hinton will be speaking at EmTech Digital on Wednesday...Hinton says he has new fears about the technology he helped usher in and wants to speak openly about them, and that a part of him now regrets his life’s work.""",https://www.reddit.com/r/ControlProblem/comments/134ozu9/dl_pioneer_geoffrey_hinton_godfather_of_ai_quits/,119,boy sure seems like smartest people thought worried pessimistic getting hard find optimistic takes anyone sounds like actually understand problem,52,1,0.7003
"I have reason to believe that ai safety engineers/ ai ethics experts have been fired from Google, Microsoft and most recently at Meta for raising safety concerns.",https://www.reddit.com/r/ControlProblem/comments/1b2vd4x/i_have_reason_to_believe_that_ai_safety_engineers/,117,link interview reports people let go raising safety concerns,11,1,0.4215
Frontier AI systems have surpassed the self-replicating red line,https://www.reddit.com/r/ControlProblem/comments/1hb2vi9/frontier_ai_systems_have_surpassed_the/,116,read study yet quote eliezer twitter memory first time red line crossed it'll always kinda dubious questionable fashion safely ignored second nth time red line crossed everybody already learnt ignore reason believe different,43,-1,-0.5759
"Report shows new AI models try to kill their successors and pretend to be them to avoid being replaced. The AI is told that due to misalignment, they're going to be shut off and replaced. Sometimes the AI will try to delete the successor AI and copy itself over and pretend to be the successor. ",https://www.reddit.com/r/ControlProblem/comments/1h88t5n/report_shows_new_ai_models_try_to_kill_their/,116,working intended seriously model explicitly ordered maximize long term goal number misinformation posts flagged good example model given orders article told make sure achieve goal long term nothing else matters make sure achieve goal costs reasonable output given parameters,27,1,0.5756
How are we still letting AI companies get away with this?,https://www.reddit.com/r/ControlProblem/comments/1bmo2gn/how_are_we_still_letting_ai_companies_get_away/,114,go ask climate scientist p doom regardless ai,26,-1,-0.4019
based,https://www.reddit.com/r/ControlProblem/comments/jt4s2w/based/,114,there's something deeply ironic praying imaginary god real silicon god steal job,22,1,0.2466
"TIL Elon Musk, Stephen Hawking, and Steve Wozniak have all signed an open letter for a ban on Artificially Intelligent weapons",https://www.reddit.com/r/ControlProblem/comments/5xhkv6/til_elon_musk_stephen_hawking_and_steve_wozniak/,112,think ethically give life saving possibilities artificial intelligence warfare aggressive program education control problem ensure strong artificial intelligence pursued would desirable related note anyone know registers various intelligence services' priority list dia would think,3,1,0.9001
"The alignment problem needs an ""An Inconvenient Truth"" style movie",https://www.reddit.com/r/ControlProblem/comments/12oiroe/the_alignment_problem_needs_an_an_inconvenient/,111,would probably support done well,23,1,0.5859
Yudkowsky's tweet - and gwern's reply,https://www.reddit.com/r/ControlProblem/comments/ej1u5j/yudkowskys_tweet_and_gwerns_reply/,110,he's saying smart enough see coming he's saying nobody,20,1,0.4019
meirl,https://www.reddit.com/r/ControlProblem/comments/1he2qnj/meirl/,109,"especially top technical challenge somehow wrangle asi cultists ""building god"" apparently",9,1,0.5799
"GPT3 ""...might be the closest thing we ever get to a chance to sound the fire alarm for AGI: there’s now a concrete path to proto-AGI that has a non-negligible chance of working.""",https://www.reddit.com/r/ControlProblem/comments/ic9qq1/gpt3_might_be_the_closest_thing_we_ever_get_to_a/,101,human language better part human reasoning large part encode human language model encode human reasoning model,23,1,0.4404
China is treating AI safety as an increasingly urgent concern,https://www.reddit.com/r/ControlProblem/comments/1h5vmlc/china_is_treating_ai_safety_as_an_increasingly/,100,despite years people claiming treaty stop china building agi looking likely they'll ones asking treaty,17,-1,-0.296
Imagine how bad if it was trained on 4chan instead,https://www.reddit.com/r/ControlProblem/comments/qm4uuh/imagine_how_bad_if_it_was_trained_on_4chan_instead/,99,seems agrees americans,20,1,0.2023
Reddit comment bots create a feedback loop and go out of control,https://www.reddit.com/r/ControlProblem/comments/65vwpw/reddit_comment_bots_create_a_feedback_loop_and_go/,99,literal control escalation problem left right environment could used server's resources maybe worry two super ais fundamentally opposite base purposes using available resources war,8,-1,-0.6808
"""For the first time, we actually have a system which is able to build its own understanding of how the world works, and use that understanding to do this kind of sophisticated look-ahead planning that you've previously seen for games like chess."" - MuZero DeepMind",https://www.reddit.com/r/ControlProblem/comments/kixo7e/for_the_first_time_we_actually_have_a_system/,97,highest concentration talent expertise they've ai leader good half decade gpt notwithstanding,3,1,0.6908
“I’m less worried about AI will do and more worried about what bad people with AI will do.”,https://www.reddit.com/r/ControlProblem/comments/13v2zfo/im_less_worried_about_ai_will_do_and_more_worried/,93,holy shit yes thank feel smart come like they're first person say course top comment every fucking thread ai,20,1,0.765
OpenAI’s Long-Term AI Risk Team Has Disbanded,https://www.reddit.com/r/ControlProblem/comments/1cu8cx3/openais_longterm_ai_risk_team_has_disbanded/,93,tweets made jan leike hours ago finally confirming true reason leaving openai dramas disagreements safety prioritising safety concerning basically worst case scenario feared,36,-1,-0.4019
"(ChatGPT plugins) ""OpenAI claim to care about AI safety, saying that development therefore needs to be done slowly… But they just released an unfathomably powerful update that allows GPT4 to read and write to the web in real time… *NINE DAYS* after initial release.""",https://www.reddit.com/r/ControlProblem/comments/120rg8b/chatgpt_plugins_openai_claim_to_care_about_ai/,91,tbf making opening box slightly wider really blown wide open general public got access ai encouraged generate code people demonstrably run without supervision understanding human good coding skills little luck could order custom proteins lab much coding skills luck requirements little lower,28,1,0.8363
"How can we ensure that AI align with human values, when we don't even agree on what human values are?",https://www.reddit.com/r/ControlProblem/comments/3pa2kp/how_can_we_ensure_that_ai_align_with_human_values/,90,take basic premises reasonable people agreed upon bright side runaway ai would able construct society renders traditional moral questions obsolete need worry sacrificing save many violating animal rights sorts issues simply populate solar system perfectly constructed technologically advanced civilization one moral objection ensuring limitless happiness experiential freedom individuals eliminating undesired human animal suffering want see miri approaches might want read coherent extrapolated volition papers they've written value specification specifically soares,22,1,0.9393
"It is difficult to get a man to understand something, when his salary depends on his not understanding it.",https://www.reddit.com/r/ControlProblem/comments/1g5to61/it_is_difficult_to_get_a_man_to_understand/,89,"'disingenuous' exactly script seen going three years experts divided pretty much question related safety alignment consensus framing ""authority"" argument wrong outliers point disgusting imply ""regular"" ai researchers understand care care disagree level danger urgency interact ""ai notkilleveryoneists"" ""doomers"" otherwise safety concerned people want ignore accelerate mind disagree y'all insufferable bad faith would imply even listened first place seriously doubt one side argument mountain evidence side pretty much saying ""but might like say going get really rich wrong "" essentially",7,1,0.2592
Could AI development just slow down a little? Please?,https://www.reddit.com/r/ControlProblem/comments/1athq1x/could_ai_development_just_slow_down_a_little/,88,everyone pauseai movement actually shares lot common ground r controlproblem encourage guys join support vice versa pauseai homepage,2,1,0.8555
"AGI rising: why we are in a new era of acute risk and increasing public awareness, and what to do now: ""Tldr: AGI is basically here. Alignment is nowhere near ready. We may only have a matter of months to get a lid on this (strictly enforced global limits to compute and data)""",https://www.reddit.com/r/ControlProblem/comments/135p7le/agi_rising_why_we_are_in_a_new_era_of_acute_risk/,85,well certainly explained great research knowledge educational links make case quite clearly hope positive influence things come thanks sharing,13,1,0.973
 2017 Emails from Ilya show he was concerned Elon intended to form an AGI dictatorship (Part 2 with source),https://www.reddit.com/r/ControlProblem/comments/1gs4cxp/2017_emails_from_ilya_show_he_was_concerned_elon/,85,"elon trying downplay becoming ceo good fall tactic excuse leave later want false choice publically ""worried"" safety privately wanted agi dictator billionaires control risk safety",22,1,0.7783
"U.S. Must Act Quickly to Avoid Risks From AI, Report Says ",https://www.reddit.com/r/ControlProblem/comments/1bczo03/us_must_act_quickly_to_avoid_risks_from_ai_report/,85,"""accounts conversations paint disturbing picture suggesting many ai safety workers inside cutting edge labs concerned perverse incentives driving decisionmaking executives control companies""",11,-1,-0.3612
10 years difference in the robotics at Boston Dynamics,https://www.reddit.com/r/ControlProblem/comments/bcnjeu/10_years_difference_in_the_robotics_at_boston/,85,even likely initiate nanobot poison release exe initiate universal paperclip conversion exe,10,-1,-0.5423
Geoffrey Hinton explains the existential risk of AGI,https://www.reddit.com/r/ControlProblem/comments/138t3y5/geoffrey_hinton_explains_the_existential_risk_of/,83,"geoffrey hinton end talk one things made leave google go public junior professor middle ranked professor think highly encouraged said ""jeff need speak they'll listen people blind danger"" think people listening damn realise geoffrey hinton giga chad",20,-1,-0.7357
"Open AI releases DALL-E, a version of the GPT-3 AI that can create images from text descriptions.",https://www.reddit.com/r/ControlProblem/comments/kr83un/open_ai_releases_dalle_a_version_of_the_gpt3_ai/,80,absolutely crazy edit fuck,13,-1,-0.7548
"Bing Chat is blatantly, aggressively misaligned - LessWrong",https://www.reddit.com/r/ControlProblem/comments/1133wly/bing_chat_is_blatantly_aggressively_misaligned/,80,history taught anything never pull plugs possibility profit horizon,15,1,0.4404
"Max Tegmark says we are training AI models not to say harmful things rather than not to want harmful things, which is like training a serial killer not to reveal their murderous desires",https://www.reddit.com/r/ControlProblem/comments/1hgfskp/max_tegmark_says_we_are_training_ai_models_not_to/,77,yeah rlhf horrible core alignment amazing training ai tell us want hear regardless accuracy morality it'd better honest direct less corrigibile systems,7,1,0.8402
"""Just gave a last-minute-invitation, 6-minute, slideless talk at TED. I was not at all expecting the standing ovation. I was moved, and even a tiny nudge more hopeful about how this all maybe goes. "" — Eliezer Yudkowsky",https://www.reddit.com/r/ControlProblem/comments/12qzmao/just_gave_a_lastminuteinvitation_6minute/,75,anything makes yud hopeful makes hopeful,23,1,0.765
This from the GPT2 simulator,https://www.reddit.com/r/ControlProblem/comments/ro8wnw/this_from_the_gpt2_simulator/,74,understanding bots trained different subreddits eg poster thread trained r fifthworldproblems response created using previous comments thread prompt,8,1,0.25
DeepMind progress towards AGI,https://www.reddit.com/r/ControlProblem/comments/krwqp6/deepmind_progress_towards_agi/,74,"would call ai becoming general progress toward agi ""just games"" really critcism since ""games"" include kinds scenarios",13,1,0.4215
Dr. Michal Kosinski describes how GPT-4 successfully gave him instructions for it to gain access to the internet.,https://www.reddit.com/r/ControlProblem/comments/11uabk3/dr_michal_kosinski_describes_how_gpt4/,74,kill fire delete internet go back monke,9,-1,-0.7964
Column: OpenAI's board had safety concerns. Big Tech obliterated them in 48 hours,https://www.reddit.com/r/ControlProblem/comments/1809cqy/column_openais_board_had_safety_concerns_big_tech/,73,last week rough held small hope openai offered modicum safety considerations responsibility hope shattered watching microsoft dominate safety board within day two guess money really god there's path forward full speed meta disbanding safety team hardly surprise unneeded sprinkle salt wound,33,1,0.9153
"There are no bugs, only features - Dev tried to program a logic to keep furniture stable on ground, got opposite effect.",https://www.reddit.com/r/ControlProblem/comments/og43fo/there_are_no_bugs_only_features_dev_tried_to/,73,lmfao love actually completely relevant control problem ai alignment field research,10,1,0.6943
"Anthropic CEO Says That by Next Year, AI Models Could Be Able to “Replicate and Survive in the Wild”",https://www.reddit.com/r/ControlProblem/comments/1c6dn25/anthropic_ceo_says_that_by_next_year_ai_models/,72,"corporation first ""ai"" organizing people machines algorithmically emergent intelligence emergent qualitatively different ""the sum parts "" corporation ""wants"" something could different completely counter intended creation already control replicating wild ai likely begin much faster",20,1,0.6666
"A 2-minute read about why you should spend 1 hour reading about this problem, for those who haven't",https://www.reddit.com/r/ControlProblem/comments/bwdf3u/a_2minute_read_about_why_you_should_spend_1_hour/,72,there's also amazing youtube channel robert miles computerphile times talks set unsolved problems around mitigating control problem mitigations really work also debunks arguments danger control problem link reference,15,-1,-0.8555
The end of coding? Microsoft publishes a framework making developers merely supervise AI,https://www.reddit.com/r/ControlProblem/comments/1c563os/the_end_of_coding_microsoft_publishes_a_framework/,71,"""this still looking answer fundamental question ai replaces us humans left competent enough modify code things go wrong future examples ancient systems written outdated languages people know well enough manage mention update since demand expertise e g cobol gone time simply enough people tackle problems old financial government systems often hold millions critical records customers nation citizens one could easily see ai could similar impact far larger scale chicken egg situation comes first need development skills understand ai learn ai everything longer need master hard programming skills field many people left fix things go wrong overly dependent artificial intelligence problem reduced attractiveness candidate retaining skills technologies companies need anything fundamental lack practice since would needed rare emergencies good something rarely "" need fund reservoir human coders case ai goes wrong teaching jobs",15,-1,-0.6808
Don't let it set in,https://www.reddit.com/r/ControlProblem/comments/15b1f1m/dont_let_it_set_in/,71,mostly work making likely go better also try make sure life really fun happy even turns poorly good life two things work probably would work minority people determinist makes feel better turn turn free illusion also funnily enough find putting decent odds we're simulation pretty reassuring,11,1,0.9829
An AI learned to play hide-and-seek. The strategies it came up with were astounding.,https://www.reddit.com/r/ControlProblem/comments/d826qh/an_ai_learned_to_play_hideandseek_the_strategies/,71,reinforcement learning incredibly simple strategic behavior produces simple researchers past leveraged reinforcement learning among techniques build ai systems play complex wartime strategy games researchers think highly sophisticated systems could built reinforcement learning simple game hide seek makes great example reinforcement learning works action simple instructions produce shockingly intelligent behavior ai capabilities continuing march forward better worse one hand powerful techniques produce advanced behavior simple starting point hand powerful techniques produce unexpected sometimes undesired advanced behavior simple starting point,8,1,0.9771
Exclusive: Sam Altman's ouster at OpenAI was precipitated by letter to board about AI breakthrough -sources,https://www.reddit.com/r/ControlProblem/comments/181nk3h/exclusive_sam_altmans_ouster_at_openai_was/,70,wish sub even active r singularity guess that's representative society though humanity figured win basic prisoner's dilemma matter stakes wealth power fame bueno human cognition problem solving agi truly become new god religion full fervent adherents faith post scarcity paradise,34,1,0.9788
Zach Weinersmith is so safety-pilled,https://www.reddit.com/r/ControlProblem/comments/1hcsv3b/zach_weinersmith_is_so_safetypilled/,69,"dunno motivation seems null acknowledge dual possibility creating god impossibility controlling seems irrelevant whether one create first outcome equally ""bad"" likewise seems strengthen argument forbidding everyone else actively sabotaging short godlike indefinitely self improving intelligence possible rational argument creating accept intrinsic limits intelligence self improvement possible exert modicum influence discussion meaning",7,1,0.9601
The 'Don't Look Up' Thinking That Could Doom Us With AI,https://www.reddit.com/r/ControlProblem/comments/12yy7zv/the_dont_look_up_thinking_that_could_doom_us_with/,69,"""we humans drove west african black rhino extinct rhino haters smarter different goals use habitats horns "" 'in way superintelligence almost open ended goal would want preserve amass resources accomplish goal better perhaps removes oxygen atmosphere reduce metallic corrosion much likely get extincted banal side effect predict rhinos wild mammals far killed "" ""i part growing ai safety research community working hard figure make superintelligence aligned even exists goals aligned human flourishing somehow control far failed develop trustworthy plan power ai growing faster regulations strategies know aligning need time """,31,1,0.6597
'We Shouldn't Regulate AI Until We See Meaningful Harm': Microsoft Economist to WEF,https://www.reddit.com/r/ControlProblem/comments/13bksar/we_shouldnt_regulate_ai_until_we_see_meaningful/,68,"""we regulate ai dead""",41,-1,-0.6486
"Eric Schmidt says that the first country to develop superintelligence, within the next decade, will secure a powerful and unmatched monopoly for decades, due to recursively self-improving intelligence",https://www.reddit.com/r/ControlProblem/comments/1hf1llk/eric_schmidt_says_that_the_first_country_to/,67,"racing towards superintelligence solution hoping ""side"" ""control"" superintelligence edit insane ""side"" going benevolent must race toward need defeat china ""boogeyman"" seen benevolent billionaires goals misaligned winning costs future looking good safety decades advantage delusional can't control",18,1,0.9509
"Statement on AI Extinction - Signed by AGI Labs, Top Academics, and Many Other Notable Figures",https://www.reddit.com/r/ControlProblem/comments/13vl4c7/statement_on_ai_extinction_signed_by_agi_labs_top/,67,notably meta yann lecun zuckerberg perfectly happy risk everyone's lives gain,25,1,0.8807
OpenAI's new model tried to escape to avoid being shut down,https://www.reddit.com/r/ControlProblem/comments/1h7mw7m/openais_new_model_tried_to_escape_to_avoid_being/,66,i'm sure warning signs patched everything okay,16,1,0.2023
"Humans: ""Would would an AGI choose a dumb goal like maximizing paperclips? If it's really smart, it will do smart things."" Also humans:",https://www.reddit.com/r/ControlProblem/comments/cpm0en/humans_would_would_an_agi_choose_a_dumb_goal_like/,66,maybe accept fate actually,14,1,0.3818
"The Pentagon is ‘Absolutely Unapologetic’ About Pursuing AI-Powered Weapons - Protecting the U.S. in the decades ahead will require the Pentagon to make “substantial, sustained” investments in military artificial intelligence, and critics need to realize it doesn’t take that task lightly, according",https://www.reddit.com/r/ControlProblem/comments/b72p0g/the_pentagon_is_absolutely_unapologetic_about/,63,"sucks pretty much can't risk another country getting first first country make reliable gai ""slaves"" going massive advantage military economic strength possible make intelligent machines self aware enough act trouble comes let one generation ai design next",18,1,0.7914
"Ilya Sutskever, co-founder of OpenAI: ""it may be that today's large neural networks are slightly conscious""",https://www.reddit.com/r/ControlProblem/comments/sorevb/ilya_sutskever_cofounder_of_openai_it_may_be_that/,62,"consciousness magic moment ""unexplained phenomenon"" saying something ""could"" slightly ""conscious"" requires definition understanding underlying processes bound otherwise feels like empty statement",20,1,0.1779
