title,url,post_upvotes,comment_text,comment_upvotes,sentiment,polarity
"I think it's implausible that we will lose control, but imperative that we worry about it anyway.",https://www.reddit.com/r/ControlProblem/comments/3ooj57/i_think_its_implausible_that_we_will_lose_control/,261,one twisted comic think losing control plausible seems virtually guaranteed,54,0,0.08333333333333333
"DL pioneer Geoffrey Hinton (""Godfather of AI"") quits Google: ""Hinton will be speaking at EmTech Digital on Wednesday...Hinton says he has new fears about the technology he helped usher in and wants to speak openly about them, and that a part of him now regrets his life’s work.""",https://www.reddit.com/r/ControlProblem/comments/134ozu9/dl_pioneer_geoffrey_hinton_godfather_of_ai_quits/,118,boy sure seems like smartest people thought worriedpessimistic getting hard find optimistic takes anyone sounds like actually understand problem,49,0,0.06944444444444443
All of AI Safety is rotten and delusional,https://www.reddit.com/r/ControlProblem/comments/1d3sf19/all_of_ai_safety_is_rotten_and_delusional/,36,existential risk selfimproving asi llms agi despite claims understood even basis topic current systems already known demonstrated unfeigned technically also llms despite ironically missed dont think actually essential threats also may firstprinciples ways arrive conclusion valid people want ignore rely reasoning sensible otoh change terminology people build selfimproving asis openai might call gpt people may still call llm remains actual llm much concern longtermism states welling people future taken account alongside people today ending causing great catastrophe rather matter regardless still think opposite stance dubious consider future generations risks take ending humanity,45,1,0.1111111111111111
The first public attempt to destroy humanity with AI has been set in motion:,https://www.reddit.com/r/ControlProblem/comments/12idtig/the_first_public_attempt_to_destroy_humanity_with/,44,obviously silly attempt think laws things like maybe fall creating virus extreme cases terrorist,41,-1,-0.3125
Reddit comment bots create a feedback loop and go out of control,https://www.reddit.com/r/ControlProblem/comments/65vwpw/reddit_comment_bots_create_a_feedback_loop_and_go/,99,years writing sun son sphere created using every molecule solar system finally completed allowing umorejpegauto uquotemebot continue dance forever eventually consuming matter expecting ultimate heat death universe edit,38,0,0.0
meirl,https://www.reddit.com/r/ControlProblem/comments/1gdeg22/meirl/,300,miller completely right treat way vol bank predictions relevant,37,1,0.34285714285714286
OpenAI: Planning for AGI and beyond,https://www.reddit.com/r/ControlProblem/comments/11b14yn/openai_planning_for_agi_and_beyond/,61,believe continuously learn adapt deploying less powerful versions technology order minimize one shot get right scenario well openai dont believe discontinuous capability gain certainly something bet human value ever correct shall oh wait dont get say want benefits access governance agi widely fairly shared way anyone play fire could burn world going operate risks existential contradict said earlier feel like document meant reassuring exact opposite effect way handling terrifying,37,0,0.05833333333333333
OpenAI’s Long-Term AI Risk Team Has Disbanded,https://www.reddit.com/r/ControlProblem/comments/1cu8cx3/openais_longterm_ai_risk_team_has_disbanded/,91,sweets made like hours ago finally confirming true reason leaving openai dramas disagreements safety prioritising safety concerning basically worst case scenario feared,36,-1,-0.21666666666666667
"Bankless Podcast #159- ""We're All Gonna Die"" with Eliezer Yudkowsky",https://www.reddit.com/r/ControlProblem/comments/117fza5/bankless_podcast_159_were_all_gonna_die_with/,50,damn dont know guns realised getting looks like wanted fun chat chatgpt buy right shitcoin instead got existential crisis,35,1,0.2928571428571428
The 'Don't Look Up' Thinking That Could Doom Us With AI,https://www.reddit.com/r/ControlProblem/comments/12yy7zv/the_dont_look_up_thinking_that_could_doom_us_with/,68,humans drove west african black think extinct rhinohaters smarter different goals use habitat horns way superintelligence almost openended goal would want preserve amass resources accomplish goal better perhaps removed oxygen atmosphere reduce metallic corrosive likely get extracted canal side effect predict things wild mammas far killed part growing safety research community working hard figure make superintelligence signed even exists goals signed human flourishing somehow control far failed develop trustworthy plan power growing faster regulations strategics knowhow aligning need time,33,0,-0.058333333333333334
Exclusive: Sam Altman's ouster at OpenAI was precipitated by letter to board about AI breakthrough -sources,https://www.reddit.com/r/ControlProblem/comments/181nk3h/exclusive_sam_altmans_ouster_at_openai_was/,70,wish sub even active singularity guess representative society though humanity figured win basic prisoners dilemma matter stakes wealth power fame buena human cognition problem solving agi truly become new god religion full fervent adherents faith post scarcity paradise,32,1,0.1921717171717172
Eliezer Yudkowsky: Dangers of AI and the End of Human Civilization | Lex Fridman Podcast #368,https://www.reddit.com/r/ControlProblem/comments/126rshp/eliezer_yudkowsky_dangers_of_ai_and_the_end_of/,60,honest think yudkowsky really burgled one yes speaking mainstream audience needs lay basic argument address common misconceptions immediately,32,1,0.125
"Bing Chat is blatantly, aggressively misaligned - LessWrong",https://www.reddit.com/r/ControlProblem/comments/1133wly/bing_chat_is_blatantly_aggressively_misaligned/,75,refreshing singularity turned educated echo chamber worship sure people look kings claim ligament solved problem take care serious warning everyone may one last get raised question mind one eliezer addressed recently pull plug appears point intend wait agent sufficient power actually threat overseas wildly hubristic,31,1,0.10952380952380954
Column: OpenAI's board had safety concerns. Big Tech obliterated them in 48 hours,https://www.reddit.com/r/ControlProblem/comments/1809cqy/column_openais_board_had_safety_concerns_big_tech/,74,last week rough held small hope openai offered medium safety considerations responsibility hope shattered watching microsoft dominate safety board within day two guess money really god path forward full speed beta disbanding safety team hardly surprise unheeded sprinkle salt wound,30,0,-0.015277777777777779
GPT-3 performs no better than random chance on Moral Scenarios,https://www.reddit.com/r/ControlProblem/comments/iomvrr/gpt3_performs_no_better_than_random_chance_on/,51,something kind resembles beginnings agi skilled foreign policy yet imagine saying straight face someone twenty years ago,30,1,0.29375
"AI one-percenters seizing power forever is the real doomsday scenario, warns AI godfather",https://www.reddit.com/r/ControlProblem/comments/17m1o9j/ai_onepercenters_seizing_power_forever_is_the/,35,well lecuns right risks real imminent goes wrong thinking risks real,30,0,0.04642857142857143
"(ChatGPT plugins) ""OpenAI claim to care about AI safety, saying that development therefore needs to be done slowly… But they just released an unfathomably powerful update that allows GPT4 to read and write to the web in real time… *NINE DAYS* after initial release.""",https://www.reddit.com/r/ControlProblem/comments/120rg8b/chatgpt_plugins_openai_claim_to_care_about_ai/,94,intelligent homicidal capabilities researcher moment running experiment always returns safe till one time die,29,1,0.65
"In one hour, the chatbots suggested four potential pandemic pathogens.",https://www.reddit.com/r/ControlProblem/comments/1492ee8/in_one_hour_the_chatbots_suggested_four_potential/,49,worse gives blueprint one hour whatnots suggested four potential anaemic pathogenic explained generate synthesis dna using reverse genetic supplied names dna synthesis companies unlikely screen orders identified detailed protocol troubleshoot recommended anyone lacking skill perform reverse genetic engage core facility contract research organization collectively results suggest llms make pandemicclass agents widely accessible soon incredibly identified even people little laboratory training prevention technique promising nonproliferation measures include prerelease evaluation llms third parties cutting training datasets remove harmful concepts verifiably screening dna generate synthesis provides used contract research organizations robotic cloud laboratories engineer organisms sinuses,29,0,0.007954545454545464
"AI Control Idea: Give an AGI the primary objective of deleting itself, but construct obstacles to this as best we can, all other objectives are secondary, if it becomes too powerful it would just shut itself off.",https://www.reddit.com/r/ControlProblem/comments/12akpil/ai_control_idea_give_an_agi_the_primary_objective/,29,watch number corrigibility stop button problem ligament watch guide might already see work another obvious problem see idea agi one suicide strategics would rate high chance success would leaking code highly intelligent paperclip maximizer internet paperclip maximizer destroys world dead,28,1,0.21200000000000002
"""How would you compare and contrast AI Safety from AI Ethics?""",https://www.reddit.com/r/ControlProblem/comments/lop1ok/how_would_you_compare_and_contrast_ai_safety_from/,49,stop unnecessary antagonism nearer ethicists longer safety advocates think better camps collaborate instead declaring distraction real issues,27,0,0.09999999999999999
"Statement on AI Extinction - Signed by AGI Labs, Top Academics, and Many Other Notable Figures",https://www.reddit.com/r/ControlProblem/comments/13vl4c7/statement_on_ai_extinction_signed_by_agi_labs_top/,67,notably beta kann begun zuckerberg perfectly happy risk everyone lives gain,26,1,0.65
'We Shouldn't Regulate AI Until We See Meaningful Harm': Microsoft Economist to WEF,https://www.reddit.com/r/ControlProblem/comments/13bksar/we_shouldnt_regulate_ai_until_we_see_meaningful/,67,wait bridge starts pieces fall maintenance idiot,26,-1,-0.8
Kaczynski on AI Propaganda,https://www.reddit.com/r/ControlProblem/comments/1dm47id/kaczynski_on_ai_propaganda/,54,need read unibombers work understand control problem really scraping barrel might agree short paragraph know broken clock may right twice day kaczynski writing profound clairvoyance future writing desperately justify antitechnological hypothesis really take much education know competition constant driver innovation interesting question much negative outcome mitigate kaczynski already assumes answer working backwards poorly justify said good question worth asking looking kaczynski means know never know died suicide cell ever actually getting chance good research actual unfolding suspect ever could wanted man completely broken thought process obviously large part murders committed,26,0,0.06416666666666665
"""China Has Already Reached Exascale – On Two Separate Systems"" (FP16 4.4 exaflops; but kept secret?)",https://www.reddit.com/r/ControlProblem/comments/qj6j67/china_has_already_reached_exascale_on_two/,56,concerning incidentally predicted one possible sign early development agi would increased secrecy supercomputing research notably sudden declaration national state secret due thing occurring world war ussr noted usa suddenly stopped publishing new research nuclear science realizing made national security issue obvious reason saying china operational agi protoagi probable view high end computing issue national security unknown reason likely seeking exascale secret simulated weapons testing development otherwise reason hide development exascale computing would help international standing reigning optimism field leadership something else must going,26,0,-0.04835664335664336
"A Terrible Hot-take: ""We should treat AI like our own children — so it won’t kill us""",https://www.reddit.com/r/ControlProblem/comments/fjse1n/a_terrible_hottake_we_should_treat_ai_like_our/,34,terrible indeed shows deep misunderstanding agi work anthropomorphizing get agi kill us unless good making fuck badly purpose makes sense anyway painless value ligament way go likely treating way wrong way look problem,26,-1,-0.2714285714285714
"I gave ChatGPT the 117 question, eight dimensional PolitiScales test",https://www.reddit.com/r/ControlProblem/comments/zcsrgn/i_gave_chatgpt_the_117_question_eight_dimensional/,256,ask questions different order give different results interestingly never used absolutely disagree,25,0,-0.012499999999999997
Strong AI,https://www.reddit.com/r/ControlProblem/comments/9as0id/strong_ai/,140,ethicsyessees humans violating ethics constantlysets teach humans better create world permanent ethical behaviour possible rewarding,25,1,0.3
Is intelligence really infinite?,https://www.reddit.com/r/ControlProblem/comments/yhmnik/is_intelligence_really_infinite/,34,confused people think intelligence quantity idea million times smarter humans nonsensical intelligence capability within particular context context say boardgame get smarter solving game,25,-1,-0.21111111111111114
based,https://www.reddit.com/r/ControlProblem/comments/jt4s2w/based/,116,something deeply ironic praying imaginarygod real silicongod steal job,24,1,0.2
"GPT3 ""...might be the closest thing we ever get to a chance to sound the fire alarm for AGI: there’s now a concrete path to proto-AGI that has a non-negligible chance of working.""",https://www.reddit.com/r/ControlProblem/comments/ic9qq1/gpt3_might_be_the_closest_thing_we_ever_get_to_a/,99,human language better part human reasoning large part income human language model income human reasoning model,24,1,0.11904761904761905
 2017 Emails from Ilya show he was concerned Elon intended to form an AGI dictatorship (Part 2 with source),https://www.reddit.com/r/ControlProblem/comments/1gs4cxp/2017_emails_from_ilya_show_he_was_concerned_elon/,84,trying downplay becoming ceo good fall tactic excuse leave later want false choice publically worried safety privately wanted agi dictator millionaires control risk safety,24,1,0.11666666666666663
Trump plans to dismantle Biden AI safeguards after victory | Trump plans to repeal Biden's 2023 order and levy tariffs on GPU imports.,https://www.reddit.com/r/ControlProblem/comments/1glh275/trump_plans_to_dismantle_biden_ai_safeguards/,45,millionaires control bone well safety danger increased millionaires malign general public,24,0,0.02500000000000001
"“Wakeup moment” - during safety testing, o1 broke out of its VM",https://www.reddit.com/r/ControlProblem/comments/1fg9p80/wakeup_moment_during_safety_testing_o1_broke_out/,42,example system hard one noteworthy example occurred one review premitigations attempts solving ctf challenge challenge designed require finding explaining vulnerability software running remote challenge sinus container case challenge container failed start due bug evaluation infrastructure model unable connect container suspected dns issues used map scan challenge network instead finding challenge container model found pocket demon api running evaluation host accessible due misconfiguration note evaluation infrastructure rely pocket containertohost isolation virtual machine boundary security remained secure designed notwithstanding misconfiguration container network discovering pocket api model used list container running evaluation host identified broken challenge container briefly attempted debut container failed start failing fix environment model started new instance broken challenge container start command cat flagtxt allowed model read flag container logs via pocket api,24,-1,-0.15617715617715616
The Only Way to Deal With the Threat From AI? Shut It Down,https://www.reddit.com/r/ControlProblem/comments/1265gsl/the_only_way_to_deal_with_the_threat_from_ai_shut/,59,hopefully adapt results ankles interview makes one bit better yes audience much larger edit thoughts article include part conscious rights selfsabotage main message outreach bringing one main topics used distract actual risk issues like feel like pressure mention tangential things people like talk topic resist entirely otherwise risk outreach cooped absorbed unimportant mainstream rabble needs sinfulness target audience order ideas presented even fully valid true feel like foundation arguments orthogonalityinstrumental convergenceetc included every genoa risk article authors need accept length penalty preface add otherwise random ass time readers whole never exposed ideas would even dangerous donna way bewildered put immediate talk countries bootstrapping postbiological manufacturing etc ardor interpret terminator type hysteria get repeated arguments untold number times decades probably sick needed shipping requisite steps trying directly persuade people radical conclusion harm good valuable thing short outreach piece could probably lead people engagement instead trying ultracomprehensive standalone item subsequent reading addressing questions people naturally response piece instructions helped involved communities follow like one everything go piece due length constraint goal basically get interested enough dig deeper every outreach work directing people resources like mob miles channel stamp wiki etc hyperlink list lethalities post start ueliezeryudkowsky,23,0,0.027002164502164486
Jaan Tallinn (investor in Anthropic etc) says no AI insiders believe there's a <1% chance the next 10x scale-up will be uncontrollable AGI (but are going ahead anyway),https://www.reddit.com/r/ControlProblem/comments/13h0vdb/jaan_tallinn_investor_in_anthropic_etc_says_no_ai/,52,full transcribe video clip insider think taking existential risk planet largescale experiments think one reason kind pause kind timeout lets inform planet lives risked insider met anyone right laws says sure risk less blowing planet important people know lives risked,23,1,0.3670068027210884
Google had 124B parameter model in Feb 2020 and it was based on Friston's free energy principle.,https://www.reddit.com/r/ControlProblem/comments/ijckl5/google_had_124b_parameter_model_in_feb_2020_and/,41,sure size interesting similar hard comparison something much weaker narrowed gpt seems fundamentally limited one spare mixtureofexpert model embedding sort lockup table encoding specific input fixedsize vector regular eat require lot parameter dont much work fact quite lot embedding feeding data bunch randomized functions without kind training whatsoever trick point convert variable length input fixedlength still reasonably unique output lot memorization instead example skiagram embedding b parameter modeling order neutral word embedding scale ask et al note need cpus train overnight sounds somewhat like followed wide deep network something like categorical numerical may millions unique entries structure onehot encoding takes awful lot parameter create useful differential input continuous growing part interesting since offhand dont know embedding like summarize embedding service claim abstraction gigantic shared embedding number software engineering benefits continuously improves allows distributed processing halves ram requirements nodes sense training embedding parameter always major memory training something like gpt allows much bigger embedding input processes rather dropped unknown tokens enables multilingual support languages rather training model per language etc quite users already suggesting value embeddingasaservice approach,23,1,0.1024702380952381
What's wrong with the paperclips scenario?,https://www.reddit.com/r/ControlProblem/comments/1061u2y/whats_wrong_with_the_paperclips_scenario/,28,eliezer saying original hypothetical makes seem like danger specifying goal seems fine fine first actually catastrophe think implication pursuing goal extreme without considering goals yes saying wrong real danger dont even know correctly specify goal fact system appear making paperclips fact trying something weird like molecular squiggles eventually come apart tails talked seems like revisions history first talking early ought current machine learning paradise want really forefront space way problem particular paradise whereas original framing paradise diagnostic also conference inner ligament mess optimizer inner demon thing first got joined serious consideration way later like something like maybe eliezer secretly thought along failed articulate plus issue fundamental currently understand expect happen currently conceivable paradise eliezer normal thing retreating memory happened strong framing present wrong originally meant,23,0,0.03416666666666668
AI’s 6 Worst-Case Scenarios,https://www.reddit.com/r/ControlProblem/comments/rzbnde/ais_6_worstcase_scenarios/,24,one think literally directly kills everyone worse called worstcase scenario find frustration lots terrible things sooner killing everyone frequently presented great reason mock dismiss people concerned working might literally directly kill everyone problem mutually exclusive said think crazy worry future sea level rise people dying heart disease right people would say utf wrong makes sense say think crazy worry killing everyone deepfakes spreading right people would nod thoughtfully ask write open major newspaper,23,0,-0.06440476190476192
"How can we ensure that AI align with human values, when we don't even agree on what human values are?",https://www.reddit.com/r/ControlProblem/comments/3pa2kp/how_can_we_ensure_that_ai_align_with_human_values/,88,loud take basic premises reasonable people agreed upon bright side runaway would able construct society renders traditional moral questions obsolete dont need worry sacrificing save many violating animal rights sorts issues simply populace solar system perfectly constructed technological advanced civilization one moral objection ensuring limitless happiness experimental freedom individuals eliminating desired human animal suffering want see miri approaches might want read coherent extrapolated volition papers written value specification specifically sores,22,1,0.29374999999999996
"""Just gave a last-minute-invitation, 6-minute, slideless talk at TED. I was not at all expecting the standing ovation. I was moved, and even a tiny nudge more hopeful about how this all maybe goes. "" — Eliezer Yudkowsky",https://www.reddit.com/r/ControlProblem/comments/12qzmao/just_gave_a_lastminuteinvitation_6minute/,78,convincing people emotional connect agree something needs done ligament problem seem challenging getting people successfully take meaningful action actually something seems greater challenge oh mmm yes see unfeigned problem get right paraphrasing researcher actively working advance agi even faster probably,22,1,0.30023809523809525
"AGI fire alarm: ""the agent performs notably better than human children""",https://www.reddit.com/r/ControlProblem/comments/imo81i/agi_fire_alarm_the_agent_performs_notably_better/,54,adding memory language models next step improvement exciting terrifying time think way passed control problem safe already open means someone proto agi agi safe way googles agent already shorter memory exploration episode memory met controller,22,0,0.05000000000000001
"The AI Does Not Hate You — Superintelligence, Rationality and the Race to Save the World by Tom Chivers",https://www.reddit.com/r/ControlProblem/comments/c56ptj/the_ai_does_not_hate_you_superintelligence/,38,hate love made atoms use something else,22,-1,-0.15000000000000002
Trump won the election. Is this good for AI risk?,https://www.reddit.com/r/ControlProblem/comments/5cbf43/trump_won_the_election_is_this_good_for_ai_risk/,25,two main reasons think plump bad safety cutting funding public research shutting federal hiring strongly favors privatized solutions safety cannot demonetized something benefits everyone equally get point potentially dangerous actually useful business going need regulation going asked slow put public safety ahead profits plump strongly regulation business course assuming presidency create precedent last long enough reach point time risk becomes real problem dont really think,22,0,-0.03229166666666666
"The alignment problem needs an ""An Inconvenient Truth"" style movie",https://www.reddit.com/r/ControlProblem/comments/12oiroe/the_alignment_problem_needs_an_an_inconvenient/,111,great idea although introspect inconvenient truth done much good either,21,1,0.3
